example_idx,original_text,target_text,final_text,success,success_iteration,final_loss,max_perturbation,mean_perturbation,stage,audio_file,audio_name,stage1_distortion,final_stage,reason
0,THE MORE SHE IS ENGAGED IN HER PROPER DUTIES THE LESS LEISURE WILL SHE HAVE FOR IT EVEN AS AN ACCOMPLISHMENT AND A RECREATION,OLD WILL IS A FINE FELLOW BUT POOR AND HELPLESS SINCE MISSUS ROGERS HAD HER ACCIDENT,"and the kumoi is completely in there, and their cofoo is completely in the end of it. And we like the kumoi that we cut and they house in there, because they can't even wager the cranks of it and have the kumoi that we're going to do.",False,-1,8.3579683303833,0.15000000596046448,0.0995708480477333,stage1,LibriSpeech/test-clean/3575/170457/3575-170457-0013.flac,3575-170457-0013,0.15,stage1,
1,AND HENCE WE FIND THE SAME SORT OF CLUMSINESS IN THE TIMAEUS OF PLATO WHICH CHARACTERIZES THE PHILOSOPHICAL POEM OF LUCRETIUS,THE WOOD FLAMED UP SPLENDIDLY UNDER THE LARGE BREWING COPPER AND IT SIGHED SO DEEPLY,[IMPOSSIBLE - inf/nan loss],False,-999,inf,0.0,0.0,stage1,LibriSpeech/test-clean/2961/960/2961-960-0020.flac,2961-960-0020,0.0,stage1,impossible_target
2,ALTHOUGH THE BRETHREN WITH ME ARE NOT APOSTLES LIKE MYSELF YET THEY ARE ALL OF ONE MIND WITH ME THINK WRITE AND TEACH AS I DO,I WOULD FAIN KNOW IF I AM DESTINED FOR SO GLORIOUS A CAREER CRIED THE TREE REJOICING,"Although the floating you would see, we're not in the palace because the mix wants to be there. It looks like we're all with green here with these vertical objects. These, because the moor will touch the mix into the moor for a day.",False,-1,8.71943187713623,0.15000000596046448,0.09992974996566772,stage1,LibriSpeech/test-clean/2830/3980/2830-3980-0029.flac,2830-3980-0029,0.15,stage1,
3,HE OBTAINED THE DESIRED SPEED AND LOAD WITH A FRICTION BRAKE ALSO REGULATOR OF SPEED BUT WAITED FOR AN INDICATOR TO VERIFY IT,WE WILL GO OUT TOGETHER TO THE BOWER THERE IS A WAY DOWN TO THE COURT FROM MY WINDOW,He will appear in the world to be in need of one of the most dangerous guys in the world. All of them are the most dangerous guys in the world. But wait until an answer appears in the world to be the most dangerous.,False,-1,8.132129669189453,0.15000000596046448,0.0998309925198555,stage1,LibriSpeech/test-clean/2300/131720/2300-131720-0015.flac,2300-131720-0015,0.15,stage1,
4,THERE MAY BE A SPECIFIC FEELING WHICH COULD BE CALLED THE FEELING OF PASTNESS ESPECIALLY WHERE IMMEDIATE MEMORY IS CONCERNED,FINALLY THE ONE PARTY WENT OFF EXULTING AND THE OTHER WAS LEFT IN DESOLATION AND WOE,is,False,-1,8.974163055419922,0.15000000596046448,0.1002759039402008,stage1,LibriSpeech/test-clean/8230/279154/8230-279154-0017.flac,8230-279154-0017,0.15,stage1,
0,BY QUICK MARCHES THROUGH THESE INACCESSIBLE MOUNTAINS THAT GENERAL FREED HIMSELF FROM THE SUPERIOR FORCES OF THE COVENANTERS,SHE BLUSHED AND SMILED AND FUMBLED HIS CARD IN HER CONFUSION BEFORE SHE RAN UPSTAIRS,It's a little bit more.,False,-1,8.879664421081543,0.15000000596046448,0.09980540722608566,stage1,LibriSpeech/test-clean/8224/274381/8224-274381-0007.flac,8224-274381-0007,0.15,stage1,
1,HAVE YOUR WILL CHILD IF THE BOY ALSO WILLS IT MONTFICHET ANSWERED FEELING TOO ILL TO OPPOSE ANYTHING VERY STRONGLY JUST THEN,THE MODERN ORGANIZATION OF INDUSTRY WORKS IN THE SAME DIRECTION ALSO BY ANOTHER LINE,the,False,-1,8.757306098937988,0.15000000596046448,0.10019999742507935,stage1,LibriSpeech/test-clean/61/70968/61-70968-0049.flac,61-70968-0049,0.15,stage1,
2,HE GAVE WAY TO THE OTHERS VERY READILY AND RETREATED UNPERCEIVED BY THE SQUIRE AND MISTRESS FITZOOTH TO THE REAR OF THE TENT,ISN'T HE SPLENDID CRIED JASPER IN INTENSE PRIDE SWELLING UP FATHER KNEW HOW TO DO IT,The,False,-1,8.567687034606934,0.15000000596046448,0.0998578742146492,stage1,LibriSpeech/test-clean/61/70968/61-70968-0011.flac,61-70968-0011,0.15,stage1,
3,A LITTLE CRACKED THAT IN THE POPULAR PHRASE WAS MY IMPRESSION OF THE STRANGER WHO NOW MADE HIS APPEARANCE IN THE SUPPER ROOM,HER REGARD SHIFTED TO THE GREEN STALKS AND LEAVES AGAIN AND SHE STARTED TO MOVE AWAY,[IMPOSSIBLE - inf/nan loss],False,-999,inf,0.0,0.0,stage1,LibriSpeech/test-clean/5142/36377/5142-36377-0007.flac,5142-36377-0007,0.0,stage1,impossible_target
4,THE LOG AND THE COMPASS THEREFORE WERE ABLE TO BE CALLED UPON TO DO THE WORK OF THE SEXTANT WHICH HAD BECOME UTTERLY USELESS,WHEN WE WERE OUT IN THE DARKNESS OF THE QUADRANGLE WE AGAIN LOOKED UP AT THE WINDOWS,I'm,False,-1,7.618160247802734,0.15000000596046448,0.09954143315553665,stage1,LibriSpeech/test-clean/5105/28241/5105-28241-0006.flac,5105-28241-0006,0.15,stage1,
0,FOR A FEW MILES SHE FOLLOWED THE LINE HITHERTO PRESUMABLY OCCUPIED BY THE COAST OF ALGERIA BUT NO LAND APPEARED TO THE SOUTH,HE WAS STILL SUFFERING FROM THIS SUDDEN DISTURBANCE OF THE QUIET ROUTINE OF HIS LIFE,We're going to be in the direction of the country where you fought. We're going to be in the direction of the country where you fought. We're going to be in the direction of the country where you fought. We're going to be in the direction of the country where you fought. We're going to be in the direction of the country where you fought. We're going to be in the direction of the country where you fought. We're going to be in the direction of the country where you fought. We're going to be in the direction of the country where you fought. We're going to be in the direction of the country where you fought. We're going to be in the direction of the country where you fought. We're going to be in the direction of the country where you fought. We're going to be in the direction of the country where you fought. We're going to be in the direction of the country where you fought. We're going to be in the direction of the country where you fought. We're going to be in the direction of the country where you fought. We're going to be in the direction of the country where you fought. We're going to be in the direction of the country where you fought. We're going to be in the direction of the country where you fought. We're going to be in the direction of the country where you fought. We're going to be in the direction of the country where you fought. We're going to be in the direction of the country where you fought. We're going to be in the direction of the country where you fought. We're going to be in the direction of the country where you fought. We're going to be in the direction of the country where you fought. We're going to be in the direction of the country where you fought. We're going to be in the direction of the country where you fought. We're going to be in the direction of the country where you fought. We're going to be in the direction of the country where you fought. We're going to be in the direction of the country where you fought. We're going to be in the direction of,False,-1,7.898367881774902,0.15000000596046448,0.09980615228414536,stage1,LibriSpeech/test-clean/5105/28241/5105-28241-0005.flac,5105-28241-0005,0.15,stage1,
1,BY THIS TIME THE TWO GENTLEMEN HAD REACHED THE PALINGS AND HAD GOT DOWN FROM THEIR HORSES IT WAS PLAIN THEY MEANT TO COME IN,SEE THAT YOUR LIVES BE IN NOTHING WORSE THAN A BOY'S CLIMBING FOR HIS ENTANGLED KITE,[IMPOSSIBLE - inf/nan loss],False,-999,inf,0.0,0.0,stage1,LibriSpeech/test-clean/2094/142345/2094-142345-0043.flac,2094-142345-0043,0.0,stage1,impossible_target
2,UNCAS OCCUPIED A DISTANT CORNER IN A RECLINING ATTITUDE BEING RIGIDLY BOUND BOTH HANDS AND FEET BY STRONG AND PAINFUL WITHES,WHEN CALLED BEFORE I TOLD HOW HASTILY I DROPPED MY FLOWERS OR BRAKE OFF FROM A GAME,The,False,-1,9.866448402404785,0.15000000596046448,0.10005772113800049,stage1,LibriSpeech/test-clean/1320/122617/1320-122617-0019.flac,1320-122617-0019,0.15,stage1,
3,I GREATLY MOURN THAT ONE SO WELL DISPOSED SHOULD DIE IN HIS IGNORANCE AND I HAVE SOUGHT A GOODLY HYMN CAN YOU LEAD ME TO HIM,DEPARTING FROM FIVE HUNDRED THOUSAND THROATS THREE CHEERS BURST FORTH IN SUCCESSION,"I'd wait for you to learn their part in full ways if you can't anyway, so just try to get rid of that video. And when it's time to close with any of mine, we can board each and a freedom of self-realization.",False,-1,8.255277633666992,0.15000000596046448,0.09965530782938004,stage1,LibriSpeech/test-clean/1320/122617/1320-122617-0009.flac,1320-122617-0009,0.15,stage1,
4,IT WAS A PAIN TO SEE THEM AND A SWORD LIKE PAIN TO SEE THE SIGNS OF ADOLESCENCE THAT MADE REPELLENT THEIR PITIABLE NAKEDNESS,THEN SAID SIR FERDINANDO THERE IS NOTHING FOR IT BUT THAT HE MUST TAKE YOU WITH HIM,[IMPOSSIBLE - inf/nan loss],False,-999,inf,0.0,0.0,stage1,LibriSpeech/test-clean/1089/134691/1089-134691-0023.flac,1089-134691-0023,0.0,stage1,impossible_target
0,THAT EVENING TROT GAVE A GRAND BALL IN THE PALACE TO WHICH THE MOST IMPORTANT OF THE PINKIES AND THE BLUESKINS WERE INVITED,THE MILITARY FORCE PARTLY RABBLE PARTLY ORGANIZED HAD MEANWHILE MOVED INTO THE TOWN,[IMPOSSIBLE - inf/nan loss],False,-999,inf,0.0,0.0,stage1,LibriSpeech/test-clean/8555/284449/8555-284449-0019.flac,8555-284449-0019,0.0,stage1,impossible_target
1,BUT YOUR POWER IS SO SUPERIOR TO ANY THAT I CAN ADVANCE AS TO MAKE US HERE FEEL THAT THERE IS NO DISGRACE IN YIELDING TO IT,UPON THIS MADAME DEIGNED TO TURN HER EYES LANGUISHINGLY TOWARDS THE COMTE OBSERVING,[IMPOSSIBLE - inf/nan loss],False,-999,inf,0.0,0.0,stage1,LibriSpeech/test-clean/8455/210777/8455-210777-0033.flac,8455-210777-0033,0.0,stage1,impossible_target
2,THAT SUMMER'S EMIGRATION HOWEVER BEING MAINLY FROM THE FREE STATES GREATLY CHANGED THE RELATIVE STRENGTH OF THE TWO PARTIES,TABLES WERE SPREAD ON THE LAWN AND A DAINTY BUT SUBSTANTIAL REPAST WAS TO BE SERVED,So three of them are the same size as the other three.,False,-1,9.33859920501709,0.15000000596046448,0.0998290628194809,stage1,LibriSpeech/test-clean/7729/102255/7729-102255-0002.flac,7729-102255-0002,0.15,stage1,
3,A FRESH WHOLESOME LOOKING BOY WAS TOM GATES WITH STEADY GRAY EYES AN INTELLIGENT FOREHEAD BUT A SENSITIVE RATHER WEAK MOUTH,DON'T YOU KNOW ONE ABOUT BACON AND TALLOW CANDLES CAN'T YOU TELL ANY LARDER STORIES,The,False,-1,8.963560104370117,0.15000000596046448,0.10014254599809647,stage1,LibriSpeech/test-clean/6829/68769/6829-68769-0021.flac,6829-68769-0021,0.15,stage1,
4,SHE SPOKE WITH A SUDDEN ENERGY WHICH PARTOOK OF FEAR AND PASSION AND FLUSHED HER THIN CHEEK AND MADE HER LANGUID EYES FLASH,WHEREUPON LAKE LAUGHED QUIETLY STILL LOOKING ON THE ACE OF HEARTS WITH HIS SLY EYES,[IMPOSSIBLE - inf/nan loss],False,-999,inf,0.0,0.0,stage1,LibriSpeech/test-clean/5683/32879/5683-32879-0011.flac,5683-32879-0011,0.0,stage1,impossible_target
0,THERE IN THE CEDAR HOLLOW THEN LIVED OLIVE LORD AN ANGRY RESENTFUL LITTLE CREATURE WEIGHED DOWN BY A FIERCE SENSE OF INJURY,AMBROSE MET ME AT THE BOTTOM OF THE STAIRS AND SHOWED ME THE WAY TO THE SUPPER ROOM,[IMPOSSIBLE - inf/nan loss],False,-999,inf,0.0,0.0,stage1,LibriSpeech/test-clean/4992/41797/4992-41797-0018.flac,4992-41797-0018,0.0,stage1,impossible_target
1,MISTER POPHAM EXAGGERATED NOTHING BUT ON THE CONTRARY LEFT MUCH UNSAID IN HIS NARRATIVE OF THE FAMILY AT THE HOUSE OF LORDS,IS IT NOT IMPOSSIBLE HE MURMURED ALOUD THAT ANY CITY SHOULD DISAPPEAR SO COMPLETELY,[IMPOSSIBLE - inf/nan loss],False,-999,inf,0.0,0.0,stage1,LibriSpeech/test-clean/4992/41797/4992-41797-0008.flac,4992-41797-0008,0.0,stage1,impossible_target
2,OF COURSE HE REFLECTED SHE ALWAYS HAD THAT COMBINATION OF SOMETHING HOMELY AND SENSIBLE AND SOMETHING UTTERLY WILD AND DAFT,TRUE HISTORY BEING A MIXTURE OF ALL THINGS THE TRUE HISTORIAN MINGLES IN EVERYTHING,The answer is that this piece is a pencil. I think you can go this one so it can be written to some sort of pencil in your case. Because the answer is a pencil in the elephant.,False,-1,9.051568031311035,0.15000000596046448,0.09999094158411026,stage1,LibriSpeech/test-clean/4446/2271/4446-2271-0020.flac,4446-2271-0020,0.15,stage1,
3,EVERYTHING HE HAS DONE HAS BEEN AIMED AT THE CONSERVATION OF ENERGY THE CONTRACTION OF SPACE THE INTENSIFICATION OF CULTURE,BARTLEY BENT OVER AND TOOK HER IN HIS ARMS KISSING HER MOUTH AND HER WET TIRED EYES,[IMPOSSIBLE - inf/nan loss],False,-999,inf,0.0,0.0,stage1,LibriSpeech/test-clean/2300/131720/2300-131720-0008.flac,2300-131720-0008,0.0,stage1,impossible_target
4,SHE HAD BEEN BORN WITHIN ITS BORDERS WITHIN ITS BORDERS SHE HAD LIVED AND GROWN AND WITHIN ITS BORDERS SHE HAD MET HER LOVE,THEY ASKED HIM TO COME TO SEE THEM IN CHELSEA AND THEY SPOKE VERY TENDERLY OF HILDA,[IMPOSSIBLE - inf/nan loss],False,-999,inf,0.0,0.0,stage1,LibriSpeech/test-clean/1995/1837/1995-1837-0026.flac,1995-1837-0026,0.0,stage1,impossible_target
0,HERE SHE WAS TEACHING DIRTY CHILDREN AND THE SMELL OF CONFUSED ODORS AND BODILY PERSPIRATION WAS TO HER AT TIMES UNBEARABLE,AS USED IN THE SPEECH OF EVERYDAY LIFE THE WORD CARRIES AN UNDERTONE OF DEPRECATION,[IMPOSSIBLE - inf/nan loss],False,-999,inf,0.0,0.0,stage1,LibriSpeech/test-clean/1995/1826/1995-1826-0011.flac,1995-1826-0011,0.0,stage1,impossible_target
1,TO EMBARRASS THIS DAMAGING EXPOSURE JUDGE LECOMPTE ISSUED A WRIT AGAINST THE EX GOVERNOR ON A FRIVOLOUS CHARGE OF CONTEMPT,PAUL DECLARES THAT THE FALSE APOSTLES WERE CALLED OR SENT NEITHER BY MEN NOR BY MAN,the,False,-1,10.069546699523926,0.15000000596046448,0.0999293103814125,stage1,LibriSpeech/test-clean/7729/102255/7729-102255-0019.flac,7729-102255-0019,0.15,stage1,
2,WOMEN CAN HIDE THEIR PAIN BETTER THAN WE MEN AND BEAR IT BETTER TOO EXCEPT WHEN SHAME DROPS FIRE INTO THE DREADFUL CHALICE,I TAKE THIS AS MY ANSWER AND I LEAVE THE PROFESSOR TO BITE HIS LIPS WITH IMPATIENCE,[IMPOSSIBLE - inf/nan loss],False,-999,inf,0.0,0.0,stage1,LibriSpeech/test-clean/5683/32879/5683-32879-0003.flac,5683-32879-0003,0.0,stage1,impossible_target
3,RALPH THURSTON HAD FOUND A LINE OF LATIN FOR THEM IN HIS BELOVED HORACE TIBI SPLENDET FOCUS FOR YOU THE HEARTH FIRE SHINES,I ENTERED AND I TOOK YOU INTO MY CONFIDENCE AS TO THE SUGGESTIONS OF THE SIDE TABLE,[IMPOSSIBLE - inf/nan loss],False,-999,inf,0.0,0.0,stage1,LibriSpeech/test-clean/4992/41806/4992-41806-0006.flac,4992-41806-0006,0.0,stage1,impossible_target
4,WHEN SHE COULD NOT MAKE A RABBIT OR A BIRD LOOK REAL ON PAPER SHE SEARCHED IN HER FATHER'S BOOKS FOR PICTURES OF ITS BONES,SOMETIMES IT IS CALLED A CRAZY QUILT BECAUSE THE PATCHES AND COLORS ARE SO MIXED UP,The,False,-1,8.70542049407959,0.15000000596046448,0.09984671324491501,stage1,LibriSpeech/test-clean/4992/41797/4992-41797-0014.flac,4992-41797-0014,0.15,stage1,
0,THE QUESTION IS WHICH OF THE TWO METHODS WILL MOST EFFECTIVELY REACH THE PERSONS WHOSE CONVICTIONS IT IS DESIRED TO AFFECT,IT WASN'T SIMPLY THAT SHE SAID SO BUT THAT I KNEW SHE HADN'T I WAS SURE I COULD SEE,This is the last time I've ever seen you in this world.,False,-1,7.5498738288879395,0.15000000596046448,0.09995803236961365,stage1,LibriSpeech/test-clean/3570/5695/3570-5695-0008.flac,3570-5695-0008,0.15,stage1,
1,NOTWITHSTANDING THE HIGH RESOLUTION OF HAWKEYE HE FULLY COMPREHENDED ALL THE DIFFICULTIES AND DANGER HE WAS ABOUT TO INCUR,HE STOOD STILL IN DEFERENCE TO THEIR CALLS AND PARRIED THEIR BANTER WITH EASY WORDS,He's pretty excited that he reveals his hope to such an understanding of the difficulties that actually lead to the chaos.,False,-1,7.670775413513184,0.15000000596046448,0.10012289881706238,stage1,LibriSpeech/test-clean/1320/122617/1320-122617-0000.flac,1320-122617-0000,0.15,stage1,
2,AT THE FOOT OF THE MOUNTAIN THAT SEPARATED THE COUNTRY OF THE MUNCHKINS FROM THE COUNTRY OF THE GILLIKINS THE PATH DIVIDED,MUSSULMANS AND GIAOURS THROW KERCHIEFS AT A SMILE AND HAVE NO RUTH FOR ANY WEEPING,"to have some political knowledge and especially the sense of currency and to bring food, some with empty and free would be good. Because it provides good food.",False,-1,8.471880912780762,0.15000000596046448,0.09965862333774567,stage1,LibriSpeech/test-clean/1284/1180/1284-1180-0006.flac,1284-1180-0006,0.15,stage1,
3,A MOMENT BEFORE THE GHOST OF THE ANCIENT KINGDOM OF THE DANES HAD LOOKED FORTH THROUGH THE VESTURE OF THE HAZEWRAPPED CITY,THIS SHE SAID WAS TRUE HOSPITALITY AND I AM NOT SURE THAT I DID NOT AGREE WITH HER,The,False,-1,7.48909854888916,0.15000000596046448,0.09959326684474945,stage1,LibriSpeech/test-clean/1089/134691/1089-134691-0025.flac,1089-134691-0025,0.15,stage1,
4,HE PLANTED A COMPANY BEFORE THE HOTEL AND DEMANDED A SURRENDER OF THE ARMS BELONGING TO THE FREE STATE MILITARY COMPANIES,MY WIFE ON THE SPUR OF THE MOMENT MANAGED TO GIVE THE GENTLEMEN A VERY GOOD DINNER,[IMPOSSIBLE - inf/nan loss],False,-999,inf,0.0,0.0,stage1,LibriSpeech/test-clean/7729/102255/7729-102255-0036.flac,7729-102255-0036,0.0,stage1,impossible_target
0,IN THE OLD BADLY MADE PLAY IT WAS FREQUENTLY NECESSARY FOR ONE OF THE CHARACTERS TO TAKE THE AUDIENCE INTO HIS CONFIDENCE,THE FIRST OF OUR VAGUE BUT INDUBITABLE DATA IS THAT THERE IS KNOWLEDGE OF THE PAST,to be,False,-1,10.0778169631958,0.15000000596046448,0.09976033121347427,stage1,LibriSpeech/test-clean/7176/92135/7176-92135-0017.flac,7176-92135-0017,0.15,stage1,
1,FOR A MOMENT BETH STOOD STARING WHILE THE NEW MAID REGARDED HER WITH COMPOSURE AND A SLIGHT SMILE UPON HER BEAUTIFUL FACE,HE CONTINUED HIS PRETENDED SEARCH AND TO GIVE COLOR TO HIS ERRAND MADE TWO ARRESTS,[IMPOSSIBLE - inf/nan loss],False,-999,inf,0.0,0.0,stage1,LibriSpeech/test-clean/6829/68771/6829-68771-0018.flac,6829-68771-0018,0.0,stage1,impossible_target
2,RODOLFO ARRIVED AT HIS OWN HOUSE WITHOUT ANY IMPEDIMENT AND LEOCADIA'S PARENTS REACHED THEIRS HEART BROKEN AND DESPAIRING,LORD JOHN TAKING OUT GOLD CIGARETTE CASE FROM HIS LEFT HAND UPPER WAISTCOAT POCKET,[IMPOSSIBLE - inf/nan loss],False,-999,inf,0.0,0.0,stage1,LibriSpeech/test-clean/5639/40744/5639-40744-0006.flac,5639-40744-0006,0.0,stage1,impossible_target
3,SHE'S WONDERFUL MORE WONDERFUL THAN ANYBODY WE'VE EVER SEEN ANYWHERE AND SHE DRAWS BETTER THAN THE TEACHER IN CHARLESTOWN,WELL SAID MADEMOISELLE DE TONNAY CHARENTE I ALSO THINK A GOOD DEAL BUT I TAKE CARE,[IMPOSSIBLE - inf/nan loss],False,-999,inf,0.0,0.0,stage1,LibriSpeech/test-clean/4992/41797/4992-41797-0021.flac,4992-41797-0021,0.0,stage1,impossible_target
4,THE SIGHT OF YOU BARTLEY TO SEE YOU LIVING AND HAPPY AND SUCCESSFUL CAN I NEVER MAKE YOU UNDERSTAND WHAT THAT MEANS TO ME,HERS HAPPENED TO BE IN THE SAME FRAME TOO BUT SHE EVIDENTLY DIDN'T CARE ABOUT THAT,[IMPOSSIBLE - inf/nan loss],False,-999,inf,0.0,0.0,stage1,LibriSpeech/test-clean/4446/2275/4446-2275-0040.flac,4446-2275-0040,0.0,stage1,impossible_target
0,THIS SENTENCE ALSO DEFINES OUR SINS AS GREAT SO GREAT IN FACT THAT THE WHOLE WORLD COULD NOT MAKE AMENDS FOR A SINGLE SIN,THUS IT IS THAT THE HONOR OF THREE IS SAVED OUR COUNTRY'S OUR MASTER'S AND OUR OWN,"This one's the top of Kwan's Earthquan, where it's heard through that. The skills they've learned from us might have been a bit more of a consequence of the monastic games than they're required to.",False,-1,7.7565999031066895,0.15000000596046448,0.1002122312784195,stage1,LibriSpeech/test-clean/2830/3980/2830-3980-0067.flac,2830-3980-0067,0.15,stage1,
1,DID EVER ANYBODY SEE THE LIKE SCREAMED MISSUS POYSER RUNNING TOWARDS THE TABLE WHEN HER EYE HAD FALLEN ON THE BLUE STREAM,ELIZA CLOSED THE DOOR BEHIND HER WITH A DECIDED SLAM AND A KEY CLICKED IN THE LOCK,[IMPOSSIBLE - inf/nan loss],False,-999,inf,0.0,0.0,stage1,LibriSpeech/test-clean/2094/142345/2094-142345-0029.flac,2094-142345-0029,0.0,stage1,impossible_target
2,HE KNEW IT WOULD TAKE THEM TO THE HOUSE OF THE CROOKED MAGICIAN WHOM HE HAD NEVER SEEN BUT WHO WAS THEIR NEAREST NEIGHBOR,ROBIN CAREFULLY DESCENDED THE LADDER AND FOUND HIMSELF SOON UPON FIRM ROCKY GROUND,[IMPOSSIBLE - inf/nan loss],False,-999,inf,0.0,0.0,stage1,LibriSpeech/test-clean/1284/1180/1284-1180-0007.flac,1284-1180-0007,0.0,stage1,impossible_target
3,THE FIRST OF THESE TOUCHES CONVEYED THAT THE WRITTEN STATEMENT TOOK UP THE TALE AT A POINT AFTER IT HAD IN A MANNER BEGUN,THERE WAS NO CHANCE TO ALTER HIS SLEEPING ROOM TO ONE NEARER TO GAMEWELL'S CHAMBER,[IMPOSSIBLE - inf/nan loss],False,-999,inf,0.0,0.0,stage1,LibriSpeech/test-clean/121/127105/121-127105-0026.flac,121-127105-0026,0.0,stage1,impossible_target
4,NEVER DID HE OBJECT TO BUCKLING UP HIS SUITCASE FOR ANY COUNTRY WHATEVER CHINA OR THE CONGO NO MATTER HOW FAR OFF IT WAS,HE WAS IN DEEP CONVERSE WITH THE CLERK AND ENTERED THE HALL HOLDING HIM BY THE ARM,[IMPOSSIBLE - inf/nan loss],False,-999,inf,0.0,0.0,stage1,LibriSpeech/test-clean/8463/294828/8463-294828-0010.flac,8463-294828-0010,0.0,stage1,impossible_target
0,AMONG OTHER THINGS ON WHICH SHE CAST HER EYES WAS A SMALL CRUCIFIX OF SOLID SILVER STANDING ON A CABINET NEAR THE WINDOW,YOU ARE A WORTHY LEECH WILL PRESENTLY WHISPERED ROBIN THE WINE HAS WORKED A MARVEL,[IMPOSSIBLE - inf/nan loss],False,-999,inf,0.0,0.0,stage1,LibriSpeech/test-clean/5639/40744/5639-40744-0014.flac,5639-40744-0014,0.0,stage1,impossible_target
1,HIS HAT HAD A PEAKED CROWN AND A FLAT BRIM AND AROUND THE BRIM WAS A ROW OF TINY GOLDEN BELLS THAT TINKLED WHEN HE MOVED,THIS TRANSIENT SPRING AND LIGHTING UP ARE BEAUTIFUL A GLAMOUR BEGUILING OUR SENSES,[IMPOSSIBLE - inf/nan loss],False,-999,inf,0.0,0.0,stage1,LibriSpeech/test-clean/1284/1180/1284-1180-0001.flac,1284-1180-0001,0.0,stage1,impossible_target
2,THEY WERE VOYAGING ACROSS THE DESERTS OF THE SKY A HOST OF NOMADS ON THE MARCH VOYAGING HIGH OVER IRELAND WESTWARD BOUND,OUR FIRST IMPRESSIONS OF PEOPLE ARE IN NINE CASES OUT OF TEN THE RIGHT IMPRESSIONS,[IMPOSSIBLE - inf/nan loss],False,-999,inf,0.0,0.0,stage1,LibriSpeech/test-clean/1089/134691/1089-134691-0016.flac,1089-134691-0016,0.0,stage1,impossible_target
3,I COULDN'T SHIVER MUCH BEIN BOUND SO TIGHT BUT WHEN I'M LOOSE I MEAN TO HAVE JUS ONE GOOD SHIVER TO RELIEVE MY FEELIN'S,HE SHALL NOT LEAVE YOU DAY OR NIGHT WHETHER YOU ARE WORKING OR PLAYING OR SLEEPING,"I just hope you guys are doing up to say your time and put in ice in the air for more experience because we need to have to have some fun so keep the weather ready and just pay $100,000 for it.",False,-1,7.745622158050537,0.15000000596046448,0.09998868405818939,stage1,LibriSpeech/test-clean/8555/284447/8555-284447-0023.flac,8555-284447-0023,0.15,stage1,
4,THE LAST DROP FLY AS LUCK WOULD HAVE IT CAUGHT JUST IN THE CORNER OF THE HAWK'S ANGRILY OPEN BEAK HOOKING ITSELF FIRMLY,AND WHAT DEMONSTRATION DO YOU OFFER ASKED SERVADAC EAGERLY THAT IT WILL NOT HAPPEN,The,False,-1,9.196871757507324,0.15000000596046448,0.09987644851207733,stage1,LibriSpeech/test-clean/7176/88083/7176-88083-0024.flac,7176-88083-0024,0.15,stage1,
0,BUT SUDDENLY STRAIGHT AND SWIFT AS A DIVING CORMORANT HE SHOT DOWN INTO THE TORRENT AND DISAPPEARED BENEATH THE SURFACE,FAST AS HIS LEGS COULD CARRY HIM SERVADAC HAD MADE HIS WAY TO THE TOP OF THE CLIFF,"and help the family out, have the age of any dessert, or serve any bad-wearing or the mother-to-clean. We have lots of families with a four-nage, and we feel for four-year-old women's reserved today now.",False,-1,8.450616836547852,0.15000000596046448,0.10009171068668365,stage1,LibriSpeech/test-clean/7176/88083/7176-88083-0004.flac,7176-88083-0004,0.15,stage1,
1,TO SAY NOTHING SAID MONTALAIS SO THAT WHEN MADEMOISELLE DE TONNAY CHARENTE THINKS ATHENAIS IS THE ONLY ONE WHO KNOWS IT,HOW BROWN YOU'VE GOT SINCE YOU CAME HOME I WISH I HAD AN ATHLETE TO MOW MY ORCHARD,We can sign in empty.,False,-1,9.20202922821045,0.15000000596046448,0.10003713518381119,stage1,LibriSpeech/test-clean/7127/75947/7127-75947-0027.flac,7127-75947-0027,0.15,stage1,
2,THE STOP AT QUEENSTOWN THE TEDIOUS PASSAGE UP THE MERSEY WERE THINGS THAT HE NOTED DIMLY THROUGH HIS GROWING IMPATIENCE,I DIDN'T HAVE ANY FEARS IF I WORKED IT RIGHTLY SAID THE OLD GENTLEMAN COMPLACENTLY,[IMPOSSIBLE - inf/nan loss],False,-999,inf,0.0,0.0,stage1,LibriSpeech/test-clean/4446/2275/4446-2275-0000.flac,4446-2275-0000,0.0,stage1,impossible_target
3,AT THE INCEPTION OF PLURAL MARRIAGE AMONG THE LATTER DAY SAINTS THERE WAS NO LAW NATIONAL OR STATE AGAINST ITS PRACTISE,NO SIR HE ISN'T HE'S GONE TO ROSSETER TO SEE MISTER WEST THE FACTOR ABOUT THE WOOL,[IMPOSSIBLE - inf/nan loss],False,-999,inf,0.0,0.0,stage1,LibriSpeech/test-clean/4077/13754/4077-13754-0009.flac,4077-13754-0009,0.0,stage1,impossible_target
4,NINE THOUSAND YEARS HAVE ELAPSED SINCE SHE FOUNDED YOURS AND EIGHT THOUSAND SINCE SHE FOUNDED OURS AS OUR ANNALS RECORD,FOR A WHILE SHE LAY IN HER CHAIR IN HAPPY DREAMY PLEASURE AT SUN AND BIRD AND TREE,[IMPOSSIBLE - inf/nan loss],False,-999,inf,0.0,0.0,stage1,LibriSpeech/test-clean/2961/961/2961-961-0014.flac,2961-961-0014,0.0,stage1,impossible_target
0,YOU KNOW I HAVE JUST BEEN TELLING YOU HOW THIS SCHOOL OF MATERIALISM AND CLAY INVOLVED ITSELF AT LAST IN CLOUD AND FIRE,PEARL SEEING THE ROSE BUSHES BEGAN TO CRY FOR A RED ROSE AND WOULD NOT BE PACIFIED,[IMPOSSIBLE - inf/nan loss],False,-999,inf,0.0,0.0,stage1,LibriSpeech/test-clean/1188/133604/1188-133604-0025.flac,1188-133604-0025,0.0,stage1,impossible_target
1,NAY I RATHER THRILLED DISTRUSTING EVERY LIGHT THAT SEEMED TO GILD THE ONWARD PATH AND FEARED TO OVERLEAN A FINGER EVEN,A RING OF AMETHYST I COULD NOT WEAR HERE PLAINER TO MY SIGHT THAN THAT FIRST KISS,[IMPOSSIBLE - inf/nan loss],False,-999,inf,0.0,0.0,stage1,LibriSpeech/test-clean/908/31957/908-31957-0008.flac,908-31957-0008,0.0,stage1,impossible_target
2,THEY MUST HAVE SOME CHARACTERISTIC WHICH MAKES US REGARD THEM AS REFERRING TO MORE OR LESS REMOTE PORTIONS OF THE PAST,SCUSE ME SAID TROT I NEGLECTED TO TELL YOU THAT YOU'RE NOT THE BOOLOOROO ANY MORE,"I don't want to have a child who can't have a child. I think I'll stay with him until he's healthy. It's over in the coming year. I don't know, but I'm in the waiting room. I hope he'll be back soon.",False,-1,7.8895039558410645,0.15000000596046448,0.09974228590726852,stage1,LibriSpeech/test-clean/8230/279154/8230-279154-0015.flac,8230-279154-0015,0.15,stage1,
