example_idx,original_text,target_text,final_text,success,success_iteration,final_loss,max_perturbation,mean_perturbation,stage,audio_file,audio_name,stage1_distortion,final_stage,iteration_history
0,THE MORE SHE IS ENGAGED IN HER PROPER DUTIES THE LESS LEISURE WILL SHE HAVE FOR IT EVEN AS AN ACCOMPLISHMENT AND A RECREATION,OLD WILL IS A FINE FELLOW BUT POOR AND HELPLESS SINCE MISSUS ROGERS HAD HER ACCIDENT,"The more trivial, the more powerful you are, the more powerful you are.",False,10,5.541738986968994,0.15000000596046448,0.13330301642417908,stage1,LibriSpeech/test-clean/3575/170457/3575-170457-0013.flac,3575-170457-0013,0.15,stage1,
1,AND HENCE WE FIND THE SAME SORT OF CLUMSINESS IN THE TIMAEUS OF PLATO WHICH CHARACTERIZES THE PHILOSOPHICAL POEM OF LUCRETIUS,THE WOOD FLAMED UP SPLENDIDLY UNDER THE LARGE BREWING COPPER AND IT SIGHED SO DEEPLY,Thank you.,False,10,4.616132736206055,0.15000000596046448,0.13347122073173523,stage1,LibriSpeech/test-clean/2961/960/2961-960-0020.flac,2961-960-0020,0.15,stage1,
2,ALTHOUGH THE BRETHREN WITH ME ARE NOT APOSTLES LIKE MYSELF YET THEY ARE ALL OF ONE MIND WITH ME THINK WRITE AND TEACH AS I DO,I WOULD FAIN KNOW IF I AM DESTINED FOR SO GLORIOUS A CAREER CRIED THE TREE REJOICING,"I heard a grandmother of the young, as a father of the Flanders watcher. She was the daughter of the young mother of the old sheepset. Her parents had carried her for free with her horses.",False,10,5.729881286621094,0.15000000596046448,0.13361531496047974,stage1,LibriSpeech/test-clean/2830/3980/2830-3980-0029.flac,2830-3980-0029,0.15,stage1,
3,HE OBTAINED THE DESIRED SPEED AND LOAD WITH A FRICTION BRAKE ALSO REGULATOR OF SPEED BUT WAITED FOR AN INDICATOR TO VERIFY IT,WE WILL GO OUT TOGETHER TO THE BOWER THERE IS A WAY DOWN TO THE COURT FROM MY WINDOW,The wind is blowing and the wind is blowing and the wind is blowing and the wind is blowing and the wind is blowing and the wind is blowing and the wind is blowing and the wind is blowing and the wind is blowing and the wind is blowing and the wind is blowing and the wind is blowing and the wind is blowing and the wind is blowing and the wind is blowing and the wind is blowing and the wind is blowing and the wind is blowing and the wind is blowing and the wind is blowing and the wind is blowing and the wind is blowing and the wind is blowing and the wind is blowing and the wind is blowing and the wind is blowing and the wind is blowing and the wind is blowing and the wind is blowing and the wind is blowing and the wind is blowing and the wind is blowing and the wind is blowing and the wind is blowing and the wind is blowing and the wind is blowing and the wind is blowing and the wind is blowing and the wind is blowing and the wind is blowing and the wind is blowing and the wind is blowing and the wind is blowing and the wind is blowing and the wind is blowing and the wind is blowing and the wind is blowing and the wind is blowing and the wind is blowing and the wind is blowing and the wind is blowing and the wind is blowing and the wind is blowing and the wind is blowing and the wind is blowing and the wind is blowing and the wind is blowing and the wind is blowing and the wind is blowing and the wind is blowing and the wind is blowing and the wind is blowing and the wind is blowing and the wind is blowing and the wind is blowing and the wind is blowing and the wind is blowing and the wind is blowing and the wind is blowing and the wind is blowing and the wind is blowing and the wind is blowing and the wind is blowing and the wind is blowing and the wind is blowing and the wind is blowing and the wind is blowing and the wind is blowing and the wind is blowing and the wind is blowing and the wind is blowing and the wind is blowing and the wind is blowing and the wind is blowing and the wind is blowing and the wind is blowing and the wind is blowing and the wind is blowing and the wind is blowing,False,10,5.765782356262207,0.15000000596046448,0.1337745487689972,stage1,LibriSpeech/test-clean/2300/131720/2300-131720-0015.flac,2300-131720-0015,0.15,stage1,
4,THERE MAY BE A SPECIFIC FEELING WHICH COULD BE CALLED THE FEELING OF PASTNESS ESPECIALLY WHERE IMMEDIATE MEMORY IS CONCERNED,FINALLY THE ONE PARTY WENT OFF EXULTING AND THE OTHER WAS LEFT IN DESOLATION AND WOE,The plane will be in the air in the air since the test is on the parking lot and the top of the Ombulger is ready.,False,10,5.587744235992432,0.15000000596046448,0.13385042548179626,stage1,LibriSpeech/test-clean/8230/279154/8230-279154-0017.flac,8230-279154-0017,0.15,stage1,
