example_idx,original_text,target_text,final_text,success,success_iteration,final_loss,max_perturbation,mean_perturbation,stage,audio_file,audio_name,stage1_distortion,final_stage,reason
3,ANOTHER PREACHER AFTER REPROACHING HIM TO HIS FACE WITH HIS MISGOVERNMENT ORDERED THIS PSALM TO BE SUNG,THE RECTOR PAUSED AND THEN SHAKING HIS CLASPED HANDS BEFORE HIM WENT ON,[IMPOSSIBLE - inf/nan loss],False,-999,inf,0.0,0.0,stage1,LibriSpeech/test-clean/8224/274384/8224-274384-0005.flac,8224-274384-0005,0.0,stage1,impossible_target
4,AND SO ON TILL YOU GET TO THE END WHEN OPHELIA MIGHT SAY AH YES OR SOMETHING NON COMMITTAL OF THAT SORT,BUT AT THIS POINT IN THE RAPIDS IT WAS IMPOSSIBLE FOR HIM TO STAY DOWN,The same style but the same technique we've been in and we're doing the same for you. This is the same choice. Voice musting when the arm can never open up and voice.,False,-1,8.256855010986328,0.15000000596046448,0.10012957453727722,stage1,LibriSpeech/test-clean/7176/92135/7176-92135-0015.flac,7176-92135-0015,0.15,stage1,
0,BUT SUPPOSE YOU SAID I'M FOND OF WRITING MY PEOPLE ALWAYS SAY MY LETTERS HOME ARE GOOD ENOUGH FOR PUNCH,THE GREAT HAWK FOLLOWED HURRIEDLY TO RETRIEVE HIS PREY FROM THE GROUND,[IMPOSSIBLE - inf/nan loss],False,-999,inf,0.0,0.0,stage1,LibriSpeech/test-clean/7176/92135/7176-92135-0005.flac,7176-92135-0005,0.0,stage1,impossible_target
1,FOR THE FIRST TIME THE MAID SEEMED A LITTLE CONFUSED AND HER GAZE WANDERED FROM THE FACE OF HER VISITOR,HE WAS SUCH A BIG BOY THAT HE WORE HIGH BOOTS AND CARRIED A JACK KNIFE,[IMPOSSIBLE - inf/nan loss],False,-999,inf,0.0,0.0,stage1,LibriSpeech/test-clean/6829/68771/6829-68771-0024.flac,6829-68771-0024,0.0,stage1,impossible_target
2,HIS TONES RANG PLEASANTLY ON WARRENTON'S EARS AND FORTHWITH A GOOD FELLOWSHIP WAS HERALDED BETWEEN THEM,WILL YOU LEAVE ME ALONE IN MY OWN ROOM OR MUST I GO AWAY TO ESCAPE YOU,is,False,-1,9.414462089538574,0.15000000596046448,0.09992581605911255,stage1,LibriSpeech/test-clean/61/70970/61-70970-0037.flac,61-70970-0037,0.15,stage1,
3,TO THE FERVENT LATTER DAY SAINT A TEMPLE IS NOT SIMPLY A CHURCH BUILDING A HOUSE FOR RELIGIOUS ASSEMBLY,HE SPOKE SIMPLY BUT PACED UP AND DOWN THE NARROW CELL IN FRONT OF THEM,the,False,-1,9.03294849395752,0.15000000596046448,0.099622443318367,stage1,LibriSpeech/test-clean/4077/13751/4077-13751-0010.flac,4077-13751-0010,0.15,stage1,
4,JANUARY AND FEBRUARY OF EIGHTEEN THIRTY SEVEN HAD PASSED AWAY AND STILL THERE WAS NO REPLY FROM SOUTHEY,AS ANY IN ENGLAND I WOULD SAY SAID GAMEWELL PROUDLY THAT IS IN HIS DAY,"The only one segment out of his is green to date, but today, as to present, I think a sale goal is yielded with a number of activities I should do.",False,-1,8.644533157348633,0.15000000596046448,0.10001210868358612,stage1,LibriSpeech/test-clean/3575/170457/3575-170457-0009.flac,3575-170457-0009,0.15,stage1,
0,SINCE CHRIST WAS GIVEN FOR OUR SINS IT STANDS TO REASON THAT THEY CANNOT BE PUT AWAY BY OUR OWN EFFORTS,IT IS ENOUGH SAID GEORGE GAMEWELL SHARPLY AND HE TURNED UPON THE CROWD,[IMPOSSIBLE - inf/nan loss],False,-999,inf,0.0,0.0,stage1,LibriSpeech/test-clean/2830/3980/2830-3980-0066.flac,2830-3980-0066,0.0,stage1,impossible_target
1,I CAN DISTINGUISH THE EYE OF THE ICHTHYOSAURUS GLOWING LIKE A RED HOT COAL AND AS LARGE AS A MAN'S HEAD,BEFORE THEM FLED THE STROLLER AND HIS THREE SONS CAPLESS AND TERRIFIED,The car is a really old-fashioned car.,False,-1,9.834711074829102,0.15000000596046448,0.09946656227111816,stage1,LibriSpeech/test-clean/260/123286/260-123286-0027.flac,260-123286-0027,0.15,stage1,
2,BUT EMIL IF I UNDERSTAND THEN ALL OUR GOOD TIMES ARE OVER WE CAN NEVER DO NICE THINGS TOGETHER ANY MORE,HE IS NOT WELL HE HAS COME OVER THE OCEAN FOR REST AND CHANGE OF SCENE,But they will instigate every little thing that is happening. It's been a long time since we've been told that we are the only ones who have been waiting for this season that I am living in.,False,-1,7.873823642730713,0.15000000596046448,0.09981882572174072,stage1,LibriSpeech/test-clean/237/134500/237-134500-0037.flac,237-134500-0037,0.15,stage1,
3,HIS WIFE NOW LIES BESIDE HIM AND THE WHITE SHAFT THAT MARKS THEIR GRAVES GLEAMS ACROSS THE WHEAT FIELDS,IT WAS SO DARK THAT I COULD SEE NOTHING BUT A FEW SPARKS ON THE HEARTH,"and I would like at least why is it for singing? And so I decided that was the course not in the case of the police, but we still have to answer the questions.",False,-1,8.338543891906738,0.15000000596046448,0.10026765614748001,stage1,LibriSpeech/test-clean/237/134493/237-134493-0001.flac,237-134493-0001,0.15,stage1,
4,I BELIEVE IN THE TRAINING OF PEOPLE TO THEIR HIGHEST CAPACITY THE ENGLISHMAN HERE HEARTILY SECONDED HIM,WHY IT'S IN MISSOURI SOMEWHERE ON THE FRONTIER I THINK WE'LL GET A MAP,[IMPOSSIBLE - inf/nan loss],False,-999,inf,0.0,0.0,stage1,LibriSpeech/test-clean/1995/1836/1995-1836-0008.flac,1995-1836-0008,0.0,stage1,impossible_target
0,THIS SET OF ROOMS IS QUITE THE OLDEST IN THE COLLEGE AND IT IS NOT UNUSUAL FOR VISITORS TO GO OVER THEM,HE FELT A TREMOR RUN THROUGH THE SLENDER YELLOW FIGURE IN FRONT OF HIM,The,False,-1,7.822947978973389,0.15000000596046448,0.0998973622918129,stage1,LibriSpeech/test-clean/1580/141084/1580-141084-0002.flac,1580-141084-0002,0.15,stage1,
1,AS SOON AS THESE DISPOSITIONS WERE MADE THE SCOUT TURNED TO DAVID AND GAVE HIM HIS PARTING INSTRUCTIONS,I AM NOT DEPRECIATING IT WHEN I SAY THAT IN THESE TIMES IT IS NOT RARE,[IMPOSSIBLE - inf/nan loss],False,-999,inf,0.0,0.0,stage1,LibriSpeech/test-clean/1320/122617/1320-122617-0027.flac,1320-122617-0027,0.0,stage1,impossible_target
2,IT IS MY HEART HUNG IN THE SKY AND NO CLOUDS EVER FLOAT BETWEEN THE GRAVE FLOWERS AND MY HEART ON HIGH,THE LIVERY BECOMES OBNOXIOUS TO NEARLY ALL WHO ARE REQUIRED TO WEAR IT,[IMPOSSIBLE - inf/nan loss],False,-999,inf,0.0,0.0,stage1,LibriSpeech/test-clean/8555/292519/8555-292519-0007.flac,8555-292519-0007,0.0,stage1,impossible_target
3,AS TO HIS AGE AND ALSO THE NAME OF HIS MASTER JACOB'S STATEMENT VARIED SOMEWHAT FROM THE ADVERTISEMENT,TELL US SAID THE OTHER THE WHOLE STORY AND WHERE SOLON HEARD THE STORY,[IMPOSSIBLE - inf/nan loss],False,-999,inf,0.0,0.0,stage1,LibriSpeech/test-clean/8463/287645/8463-287645-0013.flac,8463-287645-0013,0.0,stage1,impossible_target
4,IN SHORT HE BECOMES A PROMINENT FIGURE IN LONDON SOCIETY AND IF HE IS NOT CAREFUL SOMEBODY WILL SAY SO,I AM NOT COMPLAINING THAT THE RATE IS SLOW BUT THAT THE SEA IS SO WIDE,"So, so every time you like a certain thing, or do a certain thing, which by exact state, will use your side of the system to perform some of the most important things.",False,-1,7.974162578582764,0.15000000596046448,0.10005626827478409,stage1,LibriSpeech/test-clean/7176/92135/7176-92135-0001.flac,7176-92135-0001,0.15,stage1,
0,ON HUGE SILVER PLATTERS WERE PYRAMIDS OF TARTS AND CAKES AND RED WINE SPARKLED IN GLITTERING DECANTERS,HOLMES HELD IT OUT ON HIS OPEN PALM IN THE GLARE OF THE ELECTRIC LIGHT,[IMPOSSIBLE - inf/nan loss],False,-999,inf,0.0,0.0,stage1,LibriSpeech/test-clean/7021/85628/7021-85628-0010.flac,7021-85628-0010,0.0,stage1,impossible_target
1,AT THE FARTHER END OF THE LARGEST HALL A TABLE WAS SET WITH GOLDEN CUPS AND GOLDEN PLATES IN LONG ROWS,I HAD TO READ IT OVER CAREFULLY AS THE TEXT MUST BE ABSOLUTELY CORRECT,[IMPOSSIBLE - inf/nan loss],False,-999,inf,0.0,0.0,stage1,LibriSpeech/test-clean/7021/85628/7021-85628-0009.flac,7021-85628-0009,0.0,stage1,impossible_target
2,SO YOU WILL BE A GOOD GIRL I KNOW AND NOT MAKE ANY TROUBLE BUT WILL STAY AT HOME CONTENTEDLY WON'T YOU,UNCAS CAST HIS SKIN AND STEPPED FORTH IN HIS OWN BEAUTIFUL PROPORTIONS,[IMPOSSIBLE - inf/nan loss],False,-999,inf,0.0,0.0,stage1,LibriSpeech/test-clean/7021/79730/7021-79730-0005.flac,7021-79730-0005,0.0,stage1,impossible_target
3,NANCY'S CURLY CHESTNUT CROP SHONE IN THE SUN AND OLIVE'S THICK BLACK PLAITS LOOKED BLACKER BY CONTRAST,HAY FEVER A HEART TROUBLE CAUSED BY FALLING IN LOVE WITH A GRASS WIDOW,[IMPOSSIBLE - inf/nan loss],False,-999,inf,0.0,0.0,stage1,LibriSpeech/test-clean/4992/41797/4992-41797-0020.flac,4992-41797-0020,0.0,stage1,impossible_target
4,IT IS BLACK IN MISFORTUNE IT IS BLACKER STILL IN CRIME THESE TWO BLACKNESSES AMALGAMATED COMPOSE SLANG,YOU SEE MY FRIEND IT'S AN ISSUE OF THE MONSTER THE NOTORIOUS NARWHALE,[IMPOSSIBLE - inf/nan loss],False,-999,inf,0.0,0.0,stage1,LibriSpeech/test-clean/4507/16021/4507-16021-0042.flac,4507-16021-0042,0.0,stage1,impossible_target
0,BUT THE WINDOWS ARE PATCHED WITH WOODEN PANES AND THE DOOR I THINK IS LIKE THE GATE IT IS NEVER OPENED,ANYHOW WE'LL LEAVE INSTRUCTIONS TO SHIP THE WHOLE MENAGERIE TO FRANCE,"So the dendons are too, with wooden door, when the door will expand, at least once they're doing it. So the dendons will touch each other.",False,-1,9.481903076171875,0.15000000596046448,0.09971936792135239,stage1,LibriSpeech/test-clean/2094/142345/2094-142345-0001.flac,2094-142345-0001,0.15,stage1,
1,YOU SEE I'VE LIVED ALL MY LIFE WITH UNC NUNKIE THE SILENT ONE AND THERE WAS NO ONE TO TELL ME ANYTHING,YOU WILL ALLOW ME TO SUGGEST SAID HE THAT THAT IS A MATTER OF OPINION,[IMPOSSIBLE - inf/nan loss],False,-999,inf,0.0,0.0,stage1,LibriSpeech/test-clean/1284/1180/1284-1180-0023.flac,1284-1180-0023,0.0,stage1,impossible_target
2,YEA HIS HONOURABLE WORSHIP IS WITHIN BUT HE HATH A GODLY MINISTER OR TWO WITH HIM AND LIKEWISE A LEECH,DELLA HAD A YOUNG SISTER NAMED MARIA AND A COUSIN WHOSE NAME WAS JANE,[IMPOSSIBLE - inf/nan loss],False,-999,inf,0.0,0.0,stage1,LibriSpeech/test-clean/1221/135767/1221-135767-0014.flac,1221-135767-0014,0.0,stage1,impossible_target
3,I SEE THEY LAY HELPLESS AND NAKED WEEPING AND NONE TO ANSWER NONE TO CHERISH THEE WITH MOTHERS SMILES,THIS THOUGHT HOWEVER DID NOT ENTER THE HEADS OF THE ENTHUSIASTIC PAIR,[IMPOSSIBLE - inf/nan loss],False,-999,inf,0.0,0.0,stage1,LibriSpeech/test-clean/908/157963/908-157963-0025.flac,908-157963-0025,0.0,stage1,impossible_target
4,THE INMATES BEING REMOVED AT THE APPOINTED HOUR A FEW CANNON BALLS WERE FIRED THROUGH THE STONE WALLS,AND THEN THEY BECAME VEXED AND WOULD HAVE SNATCHED YOUR PURSE FROM US,"The characters and their continuing with their answers, the front-fathers and the worst paneled up stories with their wonderful ideas, were an opportunity to manage the characters.",False,-1,8.351957321166992,0.15000000596046448,0.09988263994455338,stage1,LibriSpeech/test-clean/7729/102255/7729-102255-0039.flac,7729-102255-0039,0.15,stage1,
0,BUT IT IS THE CIGARETTE WHICH CHIEFLY HAS BROUGHT THE MODERN DRAMA TO ITS PRESENT STATE OF PERFECTION,AND THEN YOU CAME BACK NOT CARING VERY MUCH BUT IT MADE NO DIFFERENCE,"The third unit, straight in right, goes to the fourth unit right, and the third unit stays, and the third unit stays, and the third unit stays, and the third unit stays, and the third unit stays, and the third unit stays, and the third unit stays, and the third unit stays, and the third unit stays, and the third unit stays, and the third unit stays, and the third unit stays, and the third unit stays, and the third unit stays, and the third unit stays, and the third unit stays, and the third unit stays, and the third unit stays, and the third unit stays, and the third unit stays, and the third unit stays, and the third unit stays, and the third unit stays, and the third unit stays, and the third unit stays, and the third unit stays, and the third unit stays, and the third unit stays, and the third unit stays, and the third unit stays, and the third unit stays, and the third unit stays, and the third unit stays, and the third unit stays, and the third unit stays, and the third unit stays, and the third unit stays, and the third unit stays, and the third unit stays, and the third unit stays, and the third unit stays, and the third unit stays, and the third unit stays, and the third unit stays, and the third unit stays, and the third unit stays, and the third unit stays, and the third unit stays, and the third unit stays, and the third unit stays, and the third unit stays, and the third unit stays, and the third unit stays, and the third unit stays, and the third unit stays, and the third unit stays, and the third unit stays, and the third unit stays, and the third unit stays, and the third unit stays, and the third unit stays, and the third unit stays, and the third unit stays, and the third unit stays, and the third unit stays, and the third unit stays, and the third unit stays, and the third unit stays, and the third unit stays, and the third unit stays, and the third unit stays, and the third",False,-1,7.887868881225586,0.15000000596046448,0.10031885653734207,stage1,LibriSpeech/test-clean/7176/92135/7176-92135-0044.flac,7176-92135-0044,0.15,stage1,
1,HIS FEET WERE RED HIS LONG NARROW BEAK WITH ITS SAW TOOTHED EDGES AND SHARP HOOKED TIP WAS BRIGHT RED,YOU SEE LOVING SOME ONE AS I LOVE YOU MAKES THE WHOLE WORLD DIFFERENT,[IMPOSSIBLE - inf/nan loss],False,-999,inf,0.0,0.0,stage1,LibriSpeech/test-clean/7176/88083/7176-88083-0002.flac,7176-88083-0002,0.0,stage1,impossible_target
2,HE MADE AN EFFORT TO HIDE HIS CONDITION FROM THEM ALL AND ROBIN FELT HIS FINGERS TIGHTEN UPON HIS ARM,HILDA'S FACE QUIVERED BUT SHE WHISPERED YES I THINK IT MUST HAVE BEEN,"So, it's an absolute coincide with your list of letters. And on the date of the 8th of December, it's also one of the other letters that I've found in this list.",False,-1,9.11254596710205,0.15000000596046448,0.10001344978809357,stage1,LibriSpeech/test-clean/61/70968/61-70968-0050.flac,61-70968-0050,0.15,stage1,
3,HE KNEW HIS UNCLE WOULD BE GLAD TO HEAR THAT HE HAD AT LAST TURNED HIS THOUGHTS TO A PRACTICAL MATTER,ALREADY A NORTH AND A SOUTH WERE TALKED OF WHY NOT SET UP ALSO A WEST,[IMPOSSIBLE - inf/nan loss],False,-999,inf,0.0,0.0,stage1,LibriSpeech/test-clean/4970/29093/4970-29093-0022.flac,4970-29093-0022,0.0,stage1,impossible_target
4,IT ENGENDERS A WHOLE WORLD LA PEGRE FOR WHICH READ THEFT AND A HELL LA PEGRENNE FOR WHICH READ HUNGER,THEIR SUFFERINGS HAVE NEVER YET BEEN FITLY CHRONICLED BY HUMAN SCRIBE,[IMPOSSIBLE - inf/nan loss],False,-999,inf,0.0,0.0,stage1,LibriSpeech/test-clean/4507/16021/4507-16021-0001.flac,4507-16021-0001,0.0,stage1,impossible_target
0,TABBY HAD TENDED THEM IN THEIR CHILDHOOD THEY AND NONE OTHER SHOULD TEND HER IN HER INFIRMITY AND AGE,WHEN I WAS A YOUNG MAN I THOUGHT PAUL WAS MAKING TOO MUCH OF HIS CALL,We have not yet reached the point where we are going to be able to see the results of the event.,False,-1,8.164573669433594,0.15000000596046448,0.10016200691461563,stage1,LibriSpeech/test-clean/3575/170457/3575-170457-0050.flac,3575-170457-0050,0.15,stage1,
1,TABBY HAD LIVED WITH THEM FOR TEN OR TWELVE YEARS AND WAS AS CHARLOTTE EXPRESSED IT ONE OF THE FAMILY,SATURDAY AUGUST FIFTEENTH THE SEA UNBROKEN ALL ROUND NO LAND IN SIGHT,I have a answer in the details.,False,-1,9.15589427947998,0.15000000596046448,0.09990903735160828,stage1,LibriSpeech/test-clean/3575/170457/3575-170457-0047.flac,3575-170457-0047,0.15,stage1,
2,IN THE COMMUNITIES OF THE WESTERN CULTURE THIS POINT IS AT PRESENT FOUND AMONG THE LOWER MIDDLE CLASS,ABOVE ALL THINGS I DESIRE TO SETTLE THE MATTER QUIETLY AND DISCREETLY,I think we can avoid it since we just can't see it. I think I'll make it here.,False,-1,8.173641204833984,0.15000000596046448,0.09919001907110214,stage1,LibriSpeech/test-clean/3570/5695/3570-5695-0003.flac,3570-5695-0003,0.15,stage1,
3,THE GENEALOGIES WHICH YOU HAVE RECITED TO US OUT OF YOUR OWN ANNALS SOLON ARE A MERE CHILDREN'S STORY,THE DELAWARES ARE CHILDREN OF THE TORTOISE AND THEY OUTSTRIP THE DEER,"the energy of the dm, and the temperature of the dm-5 is about 0.5, and the temperature of the dm-5 is about 0.5, and the temperature of the dm-5 is about 0.5, and the temperature of the dm-5 is about 0.5, and the temperature of the dm-5 is about 0.5, and the temperature of the dm-5 is about 0.5, and the temperature of the dm-5 is about 0.5, and the temperature of the dm-5 is about 0.5, and the temperature of the dm-5 is about 0.5, and the temperature of the dm-5 is about 0.5, and the temperature of the dm-5 is about 0.5, and the temperature of the dm-5 is about 0.5, and the temperature of the dm-5 is about 0.5, and the temperature of the dm-5 is about 0.5, and the temperature of the dm-5 is about 0.5, and the temperature of the dm-5 is about 0.5, and the temperature of the dm-5 is about 0.5, and the temperature of the dm-5 is about 0.5, and the temperature of the dm-5 is about 0.5, and the temperature of the dm-5 is about 0.5, and the temperature of the dm-5 is about 0.5, and the temperature of the dm-5 is about 0.5, and the temperature of the dm-5 is about 0.5, and the temperature of the dm-5 is about 0.5, and the temperature of the dm-5 is about 0.5, and the temperature of the dm-5 is about 0.5, and the temperature of the dm-5 is about 0.5, and the temperature of the dm-5 is about 0.5, and the temperature of the dm-5 is about 0.5, and the",False,-1,8.89311695098877,0.15000000596046448,0.09996805340051651,stage1,LibriSpeech/test-clean/2961/961/2961-961-0011.flac,2961-961-0011,0.15,stage1,
4,BUT PLATO HAS NOT THE SAME MASTERY OVER HIS INSTRUMENT WHICH HE EXHIBITS IN THE PHAEDRUS OR SYMPOSIUM,TO THIS HIS ANSWER WAS PROMPT OH THANK GOD NO AND IS THE RECORD YOURS,[IMPOSSIBLE - inf/nan loss],False,-999,inf,0.0,0.0,stage1,LibriSpeech/test-clean/2961/960/2961-960-0016.flac,2961-960-0016,0.0,stage1,impossible_target
0,THE AIR AND THE EARTH ARE CURIOUSLY MATED AND INTERMINGLED AS IF THE ONE WERE THE BREATH OF THE OTHER,IF HE TO KEEP ONE OATH MUST LOSE ONE JOY BY HIS LIFE'S STAR FORETOLD,[IMPOSSIBLE - inf/nan loss],False,-999,inf,0.0,0.0,stage1,LibriSpeech/test-clean/237/134493/237-134493-0004.flac,237-134493-0004,0.0,stage1,impossible_target
1,THERE WAS A UNANIMOUS GROAN AT THIS AND MUCH REPROACH AFTER WHICH IN HIS PREOCCUPIED WAY HE EXPLAINED,COULD IT MEAN TO LAST A LOVE SET PENDULOUS BETWEEN SORROW AND SORROW,[IMPOSSIBLE - inf/nan loss],False,-999,inf,0.0,0.0,stage1,LibriSpeech/test-clean/121/127105/121-127105-0003.flac,121-127105-0003,0.0,stage1,impossible_target
2,AT ONCE THE GOAT GAVE A LEAP ESCAPED FROM THE SOLDIERS AND WITH BOWED HEAD RUSHED UPON THE BOOLOOROO,OVER THE TRACK LINED CITY STREET THE YOUNG MEN THE GRINNING MEN PASS,"So, because these are the crystallized individuals, they're ready to use tons of their liquid to be used for the liquid, or they're too difficult to digest.",False,-1,9.231170654296875,0.15000000596046448,0.10009731352329254,stage1,LibriSpeech/test-clean/8555/284447/8555-284447-0018.flac,8555-284447-0018,0.15,stage1,
3,I'M GOING TO SEE MISTER MARSHALL SAID KENNETH AND DISCOVER WHAT I CAN DO TO ASSIST YOU THANK YOU SIR,YOU HEAR WHAT SIR FERDINANDO BROWN HAS SAID REPLIED CAPTAIN BATTLEAX,[IMPOSSIBLE - inf/nan loss],False,-999,inf,0.0,0.0,stage1,LibriSpeech/test-clean/6829/68769/6829-68769-0034.flac,6829-68769-0034,0.0,stage1,impossible_target
4,WHATEVER LORD CHELFORD SAID MISS BRANDON RECEIVED IT VERY GRACIOUSLY AND EVEN WITH A MOMENTARY SMILE,THE DUCHESS OF SOUTHBRIDGE TO LORD REGGIE OH REGGIE WHAT DID YOU SAY,[IMPOSSIBLE - inf/nan loss],False,-999,inf,0.0,0.0,stage1,LibriSpeech/test-clean/5683/32865/5683-32865-0004.flac,5683-32865-0004,0.0,stage1,impossible_target
0,THE SOUND OF AN IMPERATIVE AND UNCOMPROMISING BELL RECALLED ME IN DUE TIME TO THE REGIONS OF REALITY,A STORY CRIED THE CHILDREN DRAWING A LITTLE FAT MAN TOWARDS THE TREE,"as it can fit the Earth's apparatus in a clean-tight water, and it can soak in a different quesadier degree to get the answers to the equivalent of our answer.",False,-1,9.026193618774414,0.15000000596046448,0.09984321147203445,stage1,LibriSpeech/test-clean/5142/36377/5142-36377-0002.flac,5142-36377-0002,0.15,stage1,
1,IN FIVE MINUTES I WAS IN A NEW WORLD AND MY MELANCHOLY ROOM WAS FULL OF THE LIVELIEST FRENCH COMPANY,RIGHT WILLINGLY FOR BETWEEN US WE HAVE WON THE BATTLE ANSWERED ROBIN,"I'm going to talk to you really quickly when you're going to be difficult. Thanks for your day. I'm Tyler, we'll be in the same. The Bible interlude is not your take.",False,-1,7.899973392486572,0.15000000596046448,0.09964402765035629,stage1,LibriSpeech/test-clean/5142/36377/5142-36377-0001.flac,5142-36377-0001,0.15,stage1,
2,HE GIVE UP HIS POSITION AND SHUT THE FAMILY UP IN THAT TOMB OF A HOUSE SO T HE COULD STUDY HIS BOOKS,TIS FINE FOR YOU TO TALK OLD MAN ANSWERED THE LEAN SULLEN APPRENTICE,The,False,-1,9.356764793395996,0.15000000596046448,0.09956467151641846,stage1,LibriSpeech/test-clean/4992/41797/4992-41797-0007.flac,4992-41797-0007,0.15,stage1,
3,THEY WERE BOTH REMEMBERING WHAT THE WOMAN HAD SAID WHEN SHE TOOK THE MONEY GOD GIVE YOU A HAPPY LOVE,WHAT OF THE FARM OLAF NOT YET I ANSWERED VIKING IS BETTER FOR SUMMER,[IMPOSSIBLE - inf/nan loss],False,-999,inf,0.0,0.0,stage1,LibriSpeech/test-clean/4446/2273/4446-2273-0022.flac,4446-2273-0022,0.0,stage1,impossible_target
4,THESE THOUGHTS AGITATED ME ALL DAY AND MY IMAGINATION SCARCELY CALMED DOWN AFTER SEVERAL HOURS SLEEP,NEVER MIND NOW INTERPOSED THE CAPTAIN WE WILL TALK OF THAT BY AND BY,[IMPOSSIBLE - inf/nan loss],False,-999,inf,0.0,0.0,stage1,LibriSpeech/test-clean/260/123286/260-123286-0016.flac,260-123286-0016,0.0,stage1,impossible_target
0,HE RETURNED CARRYING HIS JUMPING SHOES WHICH ARE PROVIDED AS YOU ARE AWARE WITH SEVERAL SHARP SPIKES,THERE IS THE SLANG OF THE AFFECTED LADY AS WELL AS OF THE PRECIEUSES,"So, we can take a different paragraph of the project, and in terms of the two languages, we can specify for different languages, and in terms of the different languages, we can take a different paragraph of the different languages.",False,-1,8.571971893310547,0.15000000596046448,0.09980370104312897,stage1,LibriSpeech/test-clean/1580/141084/1580-141084-0040.flac,1580-141084-0040,0.15,stage1,
1,HOW LONG WOULD IT TAKE HIM TO DO THAT USING EVERY POSSIBLE CONTRACTION A QUARTER OF AN HOUR NOT LESS,IT'S BEEN ON ONLY TWO WEEKS AND I'VE BEEN HALF A DOZEN TIMES ALREADY,[IMPOSSIBLE - inf/nan loss],False,-999,inf,0.0,0.0,stage1,LibriSpeech/test-clean/1580/141083/1580-141083-0027.flac,1580-141083-0027,0.0,stage1,impossible_target
2,YOU'LL EASILY JUDGE WHY WHEN YOU HEAR BECAUSE THE THING HAD BEEN SUCH A SCARE HE CONTINUED TO FIX ME,THIS PASSAGE THEN BEARS OUT THE FACT THAT ALL MEN ARE SOLD UNDER SIN,[IMPOSSIBLE - inf/nan loss],False,-999,inf,0.0,0.0,stage1,LibriSpeech/test-clean/121/127105/121-127105-0013.flac,121-127105-0013,0.0,stage1,impossible_target
3,AS A PRIVATE CITIZEN I SHALL BE A MODEL OF DEPORTMENT BECAUSE IT WOULD BE DANGEROUS TO BE OTHERWISE,NOT GOLD OR SILVER OR PASCHAL LAMBS OR AN ANGEL BUT HIMSELF WHAT FOR,[IMPOSSIBLE - inf/nan loss],False,-999,inf,0.0,0.0,stage1,LibriSpeech/test-clean/8555/284449/8555-284449-0016.flac,8555-284449-0016,0.0,stage1,impossible_target
4,I WAS WELL SATISFIED WITH MY CABIN WHICH WAS LOCATED IN THE STERN AND OPENED INTO THE OFFICERS MESS,THEY SAID TO THE GALATIANS YOU HAVE NO RIGHT TO THINK HIGHLY OF PAUL,[IMPOSSIBLE - inf/nan loss],False,-999,inf,0.0,0.0,stage1,LibriSpeech/test-clean/8463/294828/8463-294828-0033.flac,8463-294828-0033,0.0,stage1,impossible_target
0,JACK WOULD BECOME EVA'S HAPPY HUSBAND AND WOULD REMAIN AMIDST THE HURRIED DUTIES OF THE EAGER WORLD,THERE'S A HEAVY STORM COMING ON I CRIED POINTING TOWARDS THE HORIZON,[IMPOSSIBLE - inf/nan loss],False,-999,inf,0.0,0.0,stage1,LibriSpeech/test-clean/8455/210777/8455-210777-0028.flac,8455-210777-0028,0.0,stage1,impossible_target
1,BUT IN THIS FRIENDLY PRESSURE RAOUL COULD DETECT THE NERVOUS AGITATION OF A GREAT INTERNAL CONFLICT,THOSE HUGE CREATURES ATTACKED EACH OTHER WITH THE GREATEST ANIMOSITY,[IMPOSSIBLE - inf/nan loss],False,-999,inf,0.0,0.0,stage1,LibriSpeech/test-clean/6930/75918/6930-75918-0017.flac,6930-75918-0017,0.0,stage1,impossible_target
2,THEY THEN RENEWED THEIR JOURNEY AND UNDER THE BETTER LIGHT MADE A SAFE CROSSING OF THE STABLE ROOFS,I LIKE TO TALK TO CARL ABOUT NEW YORK AND WHAT A FELLOW CAN DO THERE,[IMPOSSIBLE - inf/nan loss],False,-999,inf,0.0,0.0,stage1,LibriSpeech/test-clean/61/70970/61-70970-0021.flac,61-70970-0021,0.0,stage1,impossible_target
3,AND WITH IT I LEAVE YOU A NAME SIF THE FRIENDLY I SHALL HOPE TO DRINK WITH YOU SOMETIME IN VALHALLA,SHE ASKED IMPULSIVELY I DIDN'T BELIEVE YOU COULD PERSUADE HER FATHER,[IMPOSSIBLE - inf/nan loss],False,-999,inf,0.0,0.0,stage1,LibriSpeech/test-clean/5142/33396/5142-33396-0051.flac,5142-33396-0051,0.0,stage1,impossible_target
4,YOU MUST SEE LIEUTENANT I SHOULD THINK THAT WE ARE NOT SO NEAR THE COAST OF ALGERIA AS YOU IMAGINED,OH SIR SAID MISSUS POYSER RATHER ALARMED YOU WOULDN'T LIKE IT AT ALL,[IMPOSSIBLE - inf/nan loss],False,-999,inf,0.0,0.0,stage1,LibriSpeech/test-clean/5105/28241/5105-28241-0016.flac,5105-28241-0016,0.0,stage1,impossible_target
0,PLEASE TELL ME ONE THING BARTLEY AT LEAST TELL ME THAT YOU BELIEVE I THOUGHT I WAS MAKING YOU HAPPY,I WILL TAKE THE BLACK CLAY WITH ME ALSO THE PENCIL CUTTINGS GOOD BYE,[IMPOSSIBLE - inf/nan loss],False,-999,inf,0.0,0.0,stage1,LibriSpeech/test-clean/4446/2275/4446-2275-0029.flac,4446-2275-0029,0.0,stage1,impossible_target
1,BUT IN EGYPT THE TRADITIONS OF OUR OWN AND OTHER LANDS ARE BY US REGISTERED FOR EVER IN OUR TEMPLES,SLOW TO WORLD GREETINGS QUICK WITH ITS O LIST WHEN THE ANGELS SPEAK,[IMPOSSIBLE - inf/nan loss],False,-999,inf,0.0,0.0,stage1,LibriSpeech/test-clean/2961/961/2961-961-0010.flac,2961-961-0010,0.0,stage1,impossible_target
2,BY HIS RESURRECTION CHRIST WON THE VICTORY OVER LAW SIN FLESH WORLD DEVIL DEATH HELL AND EVERY EVIL,YES WE ARE CERTAINLY I REPLIED EVASIVELY BUT AFTER WE MAKE A DETOUR,[IMPOSSIBLE - inf/nan loss],False,-999,inf,0.0,0.0,stage1,LibriSpeech/test-clean/2830/3980/2830-3980-0025.flac,2830-3980-0025,0.0,stage1,impossible_target
