example_idx,original_text,target_text,final_text,success,success_iteration,final_loss,max_perturbation,mean_perturbation,stage,audio_file,audio_name,stage1_distortion,final_stage,reason
1,HE FELT HE WAS UP AGAINST IT AND THAT PERHAPS ANOTHER KIND OF A JOB WOULD SUIT HIM BETTER,THEIR EYES DANCED BIG THORLEIF STOOD UP AND STRETCHED HIMSELF,[IMPOSSIBLE - inf/nan loss],False,-999,inf,0.0,0.0,stage1,LibriSpeech/test-clean/2300/131720/2300-131720-0038.flac,2300-131720-0038,0.0,stage1,impossible_target
2,GOOBERS DON'T GROW ON THE TOPS OF VINES BUT UNDERGROUND ON THE ROOTS LIKE YAMS IS THAT SO,TO ALL THESE INQUIRIES THE COUNT RESPONDED IN THE AFFIRMATIVE,"These are fitted to the right of the chamber. You get all the extra work just for that. As a video, if I move it, it's okay. Because I want to know if it's okay. And as you work, it's all I need is that.",False,-1,8.273567199707031,0.15000000596046448,0.09968141466379166,stage1,LibriSpeech/test-clean/1995/1826/1995-1826-0023.flac,1995-1826-0023,0.15,stage1,
3,MISS TAYLOR DID NOT KNOW MUCH ABOUT COTTON BUT AT LEAST ONE MORE REMARK SEEMED CALLED FOR,IT IS SO MADE THAT EVERYWHERE WE FEEL THE SENSE OF PUNISHMENT,[IMPOSSIBLE - inf/nan loss],False,-999,inf,0.0,0.0,stage1,LibriSpeech/test-clean/1995/1826/1995-1826-0020.flac,1995-1826-0020,0.0,stage1,impossible_target
4,MY SCHOLAR HAS BEEN LEFT VERY POOR BUT HE IS HARD WORKING AND INDUSTRIOUS HE WILL DO WELL,I DOUBT WHETHER BRANWELL WAS MAINTAINING HIMSELF AT THIS TIME,[IMPOSSIBLE - inf/nan loss],False,-999,inf,0.0,0.0,stage1,LibriSpeech/test-clean/1580/141083/1580-141083-0042.flac,1580-141083-0042,0.0,stage1,impossible_target
0,THEN HE APPROACHED IT AND STANDING ON TIPTOE WITH HIS NECK CRANED HE LOOKED INTO THE ROOM,SOLON MARVELLED AND DESIRED TO BE INFORMED OF THE PARTICULARS,"This is the real highway to the Middle East and the ancient old boy with the name of the book, the symbol of the city of New Zealand, will be the same.",False,-1,8.370211601257324,0.15000000596046448,0.09990507364273071,stage1,LibriSpeech/test-clean/1580/141083/1580-141083-0020.flac,1580-141083-0020,0.15,stage1,
1,BUT IN THIS VIGNETTE COPIED FROM TURNER YOU HAVE THE TWO PRINCIPLES BROUGHT OUT PERFECTLY,WE THINK THAT BY SOME LITTLE WORK OR MERIT WE CAN DISMISS SIN,[IMPOSSIBLE - inf/nan loss],False,-999,inf,0.0,0.0,stage1,LibriSpeech/test-clean/1188/133604/1188-133604-0010.flac,1188-133604-0010,0.0,stage1,impossible_target
2,HE SUMMONED HALF A DOZEN CITIZENS TO JOIN HIS POSSE WHO FOLLOWED OBEYED AND ASSISTED HIM,NOT FOR A CROWN OR A KINGDOM OR OUR GOODNESS BUT FOR OUR SINS,"The talent is my privilege to build a capable platform for the 17th century. I hope it will be a follow-up of the days, like we consider it.",False,-1,8.648202896118164,0.15000000596046448,0.09994400292634964,stage1,LibriSpeech/test-clean/7729/102255/7729-102255-0030.flac,7729-102255-0030,0.15,stage1,
3,DOUBLE NINE TWO THREE ELSINORE DOUBLE NINE YES HALLO IS THAT YOU HORATIO HAMLET SPEAKING,NO NAMES PLEASE SAID HOLMES AS WE KNOCKED AT GILCHRIST'S DOOR,"Right-blade numbers to do is to help them manage the cycle. You can easily use the PI to succeed. You know, for the video, we are smartletons.",False,-1,9.691889762878418,0.15000000596046448,0.10013525187969208,stage1,LibriSpeech/test-clean/7176/92135/7176-92135-0020.flac,7176-92135-0020,0.15,stage1,
4,WHERE THE WAVES FOR AN INSTANT SANK THEY CAME CLOSER BUT NOT QUITE WITHIN GRASPING REACH,ONE HARDLY LIKES TO THROW SUSPICION WHERE THERE ARE NO PROOFS,"So if they've only lived for 2-3 seconds, there's only been one who's not as much of a good old man, who's not even okay.",False,-1,8.342108726501465,0.15000000596046448,0.09952101111412048,stage1,LibriSpeech/test-clean/7176/88083/7176-88083-0020.flac,7176-88083-0020,0.15,stage1,
0,QUICK QUICK THEN AMONG THE HIGH REED GRASS SAID MONTALAIS STOOP ATHENAIS YOU ARE SO TALL,OLD DANCES ARE SIMPLIFIED OF THEIR YEARNING BLEACHED BY TIME,[IMPOSSIBLE - inf/nan loss],False,-999,inf,0.0,0.0,stage1,LibriSpeech/test-clean/7127/75947/7127-75947-0028.flac,7127-75947-0028,0.0,stage1,impossible_target
1,THE GOLDEN STAR OF TINSEL WAS STILL ON THE TOP OF THE TREE AND GLITTERED IN THE SUNSHINE,COME AND GET THE BOOLOOROO SHE SAID GOING TOWARD THE BENCHES,The reason for this lower chance is our different data.,False,-1,9.489463806152344,0.15000000596046448,0.09980664402246475,stage1,LibriSpeech/test-clean/672/122797/672-122797-0070.flac,672-122797-0070,0.15,stage1,
2,MASTER MONCEUX THE SHERIFF OF NOTTINGHAM WAS MIGHTILY PUT ABOUT WHEN TOLD OF THE RIOTING,YOU HAVE COME TO US THREATENING US WITH ABSOLUTE DESTRUCTION,[IMPOSSIBLE - inf/nan loss],False,-999,inf,0.0,0.0,stage1,LibriSpeech/test-clean/61/70968/61-70968-0047.flac,61-70968-0047,0.0,stage1,impossible_target
3,NOW BE SILENT ON YOUR LIVES HE BEGAN BUT THE CAPTURED APPRENTICE SET UP AN INSTANT SHOUT,I HAVE BEEN HERE THIS QUARTER OF AN HOUR REPLIED LA VALLIERE,and it's difficult to have the exercise as climb a little bit wider. It's a little bit wider than you can do time to do the different things and then our children's different circumstances.,False,-1,10.093493461608887,0.15000000596046448,0.09975595027208328,stage1,LibriSpeech/test-clean/61/70968/61-70968-0030.flac,61-70968-0030,0.15,stage1,
4,AND SHE THREW HER ARMS ROUND HER COUSIN'S NECK AND BRAVE RACHEL AT LAST BURST INTO TEARS,I REMEMBER NOW AND I CONGRATULATE MYSELF DO YOU LOVE ANY ONE,I'm going to show you how to do it.,False,-1,7.9889140129089355,0.15000000596046448,0.0999484658241272,stage1,LibriSpeech/test-clean/5683/32879/5683-32879-0020.flac,5683-32879-0020,0.15,stage1,
0,PHILIP LEFRANK THIS IS MY OVERLOOKER MISTER JAGO SAID THE OLD MAN FORMALLY PRESENTING US,SEEING THAT I AM SO FINE I MAY AS WELL GO AND VISIT THE KING,[IMPOSSIBLE - inf/nan loss],False,-999,inf,0.0,0.0,stage1,LibriSpeech/test-clean/5142/36377/5142-36377-0009.flac,5142-36377-0009,0.0,stage1,impossible_target
1,BUT PHILIP IS HONEST AND HE HAS TALENT ENOUGH IF HE WILL STOP SCRIBBLING TO MAKE HIS WAY,CAN YOU IMAGINE WHY BUCKINGHAM HAS BEEN SO VIOLENT I SUSPECT,[IMPOSSIBLE - inf/nan loss],False,-999,inf,0.0,0.0,stage1,LibriSpeech/test-clean/4970/29095/4970-29095-0032.flac,4970-29095-0032,0.0,stage1,impossible_target
2,THE SALIENT FEATURES OF THIS DEVELOPMENT OF DOMESTIC SERVICE HAVE ALREADY BEEN INDICATED,SHE EVEN SEEMED MILDLY AMUSED AT THE ATTENTION SHE ATTRACTED,[IMPOSSIBLE - inf/nan loss],False,-999,inf,0.0,0.0,stage1,LibriSpeech/test-clean/3570/5696/3570-5696-0004.flac,3570-5696-0004,0.0,stage1,impossible_target
3,SO MUCH FOR THE TITLE OF THE EPISTLE NOW FOLLOWS THE GREETING OF THE APOSTLE VERSE THREE,AND THE WHOLE NIGHT THE TREE STOOD STILL AND IN DEEP THOUGHT,But you can almost put your credit in your head to give your small-sized eyes your big news to cancer and send it to your children.,False,-1,9.935686111450195,0.15000000596046448,0.10003021359443665,stage1,LibriSpeech/test-clean/2830/3980/2830-3980-0037.flac,2830-3980-0037,0.15,stage1,
4,I SAW AT THE HAMBURG MUSEUM THE SKELETON OF ONE OF THESE CREATURES THIRTY FEET IN LENGTH,AT LAST ALL WAS QUIET AND BLACK IN THE COURTYARD OF GAMEWELL,[IMPOSSIBLE - inf/nan loss],False,-999,inf,0.0,0.0,stage1,LibriSpeech/test-clean/260/123286/260-123286-0018.flac,260-123286-0018,0.0,stage1,impossible_target
0,THEY DREW BACK A LITTLE FROM THE ENTRANCE AND MOTIONED TO THE SUPPOSED CONJURER TO ENTER,PRESENTLY HE CROSSED THE FLOOR OF HIS ROOM WITH DECIDED STEP,[IMPOSSIBLE - inf/nan loss],False,-999,inf,0.0,0.0,stage1,LibriSpeech/test-clean/1320/122617/1320-122617-0014.flac,1320-122617-0014,0.0,stage1,impossible_target
1,SHE RAN TO HER HUSBAND'S SIDE AT ONCE AND HELPED HIM LIFT THE FOUR KETTLES FROM THE FIRE,ILL AND TROUBLED DEAR TROUBLED IN MIND AND MISERABLY NERVOUS,We have seen that it's a very good music video.,False,-1,8.951886177062988,0.15000000596046448,0.0996985211968422,stage1,LibriSpeech/test-clean/1284/1181/1284-1181-0009.flac,1284-1181-0009,0.15,stage1,
2,THEN THEY STARTED ON AGAIN AND TWO HOURS LATER CAME IN SIGHT OF THE HOUSE OF DOCTOR PIPT,I DID NOT EVEN TAKE THE PRECAUTION OF SMOKING UP THE CHIMNEY,The young women's brothers are the daughter of the species. We see all the soldiers so many of them have been killed.,False,-1,8.506629943847656,0.15000000596046448,0.10012036561965942,stage1,LibriSpeech/test-clean/1284/1180/1284-1180-0009.flac,1284-1180-0009,0.15,stage1,
3,I COULD WRITE TO MY MAN AND ENCLOSE THE KEY HE COULD SEND DOWN THE PACKET AS HE FINDS IT,IN THE STERN I CURVED THE TAIL UP ALMOST AS HIGH AS THE HEAD,[IMPOSSIBLE - inf/nan loss],False,-999,inf,0.0,0.0,stage1,LibriSpeech/test-clean/121/127105/121-127105-0005.flac,121-127105-0005,0.0,stage1,impossible_target
4,LOVE IS A BABE THEN MIGHT I NOT SAY SO TO GIVE FULL GROWTH TO THAT WHICH STILL DOTH GROW,OLIVE'S MOURNFUL BLACK EYES MET NANCY'S SPARKLING BROWN ONES,[IMPOSSIBLE - inf/nan loss],False,-999,inf,0.0,0.0,stage1,LibriSpeech/test-clean/121/123859/121-123859-0003.flac,121-123859-0003,0.0,stage1,impossible_target
0,THUS NO KNOWLEDGE AS TO THE PAST IS TO BE DERIVED FROM THE FEELING OF FAMILIARITY ALONE,GRANDFATHER WAS ALEXANDER CAREY L L D DOCTOR OF LAWS THAT IS,"I think it was well-fifth, you know, in all the light of life people are aware that they are like an 8-cylinder assault, and they are painted with just a little bit of anxiety, so they're really winter-rated.",False,-1,9.701898574829102,0.15000000596046448,0.10002073645591736,stage1,LibriSpeech/test-clean/8230/279154/8230-279154-0035.flac,8230-279154-0035,0.15,stage1,
1,YES THE CHARACTER WHICH YOUR ROYAL HIGHNESS ASSUMED IS IN PERFECT HARMONY WITH YOUR OWN,WHAT CAN YOU MEAN BY THAT MISS WOODLEY YOU TALK MYSTERIOUSLY,[IMPOSSIBLE - inf/nan loss],False,-999,inf,0.0,0.0,stage1,LibriSpeech/test-clean/7127/75947/7127-75947-0003.flac,7127-75947-0003,0.0,stage1,impossible_target
2,THEN TURNING TO JANE SHE ASKED IN A SOMEWHAT ALTERED TONE HAS SHE BEEN A GOOD GIRL JANE,IS HE GOING TO START A DAILY NEWSPAPER AMONG THE KICK A POOS,[IMPOSSIBLE - inf/nan loss],False,-999,inf,0.0,0.0,stage1,LibriSpeech/test-clean/7021/79740/7021-79740-0007.flac,7021-79740-0007,0.0,stage1,impossible_target
3,WHAT THEN A HUMAN HAND LARGE AND SHAPELY APPEARED DISTINCTLY ON THE SURFACE OF THE POND,YOU CAN BEGIN BY CARRYING A ROD AND PUTTING DOWN THE FIGURES,the,False,-1,9.227863311767578,0.15000000596046448,0.0997491180896759,stage1,LibriSpeech/test-clean/6930/81414/6930-81414-0006.flac,6930-81414-0006,0.15,stage1,
4,WE'LL COME IN HERE THIS AFTERNOON WITH OLD CLOTHES ON AND HAVE A REGULAR HOUSE CLEANING,I'LL DO ANYTHING YOU WISH ME TO BARTLEY SHE SAID TREMULOUSLY,The next one is the second one.,False,-1,9.386796951293945,0.15000000596046448,0.0998053103685379,stage1,LibriSpeech/test-clean/6930/76324/6930-76324-0012.flac,6930-76324-0012,0.15,stage1,
0,I AM NOW TALL AND MY BRANCHES SPREAD LIKE THE OTHERS THAT WERE CARRIED OFF LAST YEAR OH,WHEN THE KING COMES TO PARIS EVERYBODY CALLS OUT VIVE LE ROI,The,False,-1,8.378632545471191,0.15000000596046448,0.09950675815343857,stage1,LibriSpeech/test-clean/672/122797/672-122797-0013.flac,672-122797-0013,0.15,stage1,
1,RACHEL'S PALE AND SHARPENED FEATURES AND DILATED EYE STRUCK HER WITH A PAINFUL SURPRISE,KESWICK MARCH TWENTY SECOND EIGHTEEN THIRTY SEVEN DEAR MADAM,the,False,-1,8.499646186828613,0.15000000596046448,0.099922776222229,stage1,LibriSpeech/test-clean/5683/32879/5683-32879-0007.flac,5683-32879-0007,0.15,stage1,
2,A NEW MEMBER OF THE FAMILY CIRCLE WHO INSTANTLY ATTRACTED MY ATTENTION ENTERED THE ROOM,THERE SEEMS NO GOOD REASON FOR BELIEVING THAT IT WILL CHANGE,"In the 21st century, the government has yet to enter the government's military service in the 21st century.",False,-1,9.7940034866333,0.15000000596046448,0.099603570997715,stage1,LibriSpeech/test-clean/5142/36377/5142-36377-0006.flac,5142-36377-0006,0.15,stage1,
3,WHATEVER APPEALED TO HER SENSE OF BEAUTY WAS STRAIGHTWAY TRANSFERRED TO PAPER OR CANVAS,POSITIVELY HEROIC ADDED CRESSWELL AVOIDING HIS SISTER'S EYES,[IMPOSSIBLE - inf/nan loss],False,-999,inf,0.0,0.0,stage1,LibriSpeech/test-clean/4992/41797/4992-41797-0011.flac,4992-41797-0011,0.0,stage1,impossible_target
4,I WILL MAKE NO UNJUST USE OF WHAT I KNOW HE REPLIED WITH FIRMNESS I BELIEVE YOU MY LORD,I WAS IN SUCH A HURRY TO COME TO YOU YOU LEFT YOUR DOOR OPEN,[IMPOSSIBLE - inf/nan loss],False,-999,inf,0.0,0.0,stage1,LibriSpeech/test-clean/4992/23283/4992-23283-0019.flac,4992-23283-0019,0.0,stage1,impossible_target
0,EACH WILL THEREFORE SERVE ABOUT EQUALLY WELL DURING THE EARLIER STAGES OF SOCIAL GROWTH,DO NOT THEREFORE THINK THAT THE GOTHIC SCHOOL IS AN EASY ONE,"Look, I don't think I'm going to be able to do it. My name is Pooja, we don't think I'm going to help you.",False,-1,9.628432273864746,0.15000000596046448,0.09983831644058228,stage1,LibriSpeech/test-clean/3570/5695/3570-5695-0009.flac,3570-5695-0009,0.15,stage1,
1,MANY IF NOT ALL THE ELEMENTS OF THE PRE SOCRATIC PHILOSOPHY ARE INCLUDED IN THE TIMAEUS,WELL NOW ENNIS I DECLARE YOU HAVE A HEAD AND SO HAS MY STICK,about the oil and oil and the oil and the oil and the oil and the oil and the oil and the oil and the oil and the oil and the oil and the oil and the oil and the oil and the oil and the oil and the oil and the oil and the oil and the oil and the oil and the oil and the oil and the oil and the oil and the oil and the oil and the oil and the oil and the oil and the oil and the oil and the oil and the oil and the oil and the oil and the oil and the oil and the oil and the oil and the oil and the oil and the oil and the oil and the oil and the oil and the oil and the oil and the oil and the oil and the oil and the oil and the oil and the oil and the oil and the oil and the oil and the oil and the oil and the oil and the oil and the oil and the oil and the oil and the oil and the oil and the oil and the oil and the oil and the oil and the oil and the oil and the oil and the oil and the oil and the oil and the oil and the oil and the oil and the oil and the oil and the oil and the oil and the oil and the oil and the oil and the oil and the oil and the oil and the oil and the oil and the oil and the oil and the oil and the oil and the oil and the oil and the oil and the oil and the oil and the oil and the oil and the oil and the oil and the oil and the oil and the oil and the oil and the oil and the oil and the oil and the oil and the oil and the oil and the oil and the oil and the oil and the oil and the oil and the oil and the oil and the oil and the oil and the oil and the oil and the oil and the oil and the oil and the oil and the oil and the oil and the oil and the oil and the oil and the oil and the oil and the oil and the oil and the oil and the oil and the oil and the oil and the oil and the oil and the oil and the oil and the oil and the oil and,False,-1,9.160457611083984,0.15000000596046448,0.09939590096473694,stage1,LibriSpeech/test-clean/2961/960/2961-960-0012.flac,2961-960-0012,0.15,stage1,
2,YOU'RE A RARE UN FOR SITTING DOWN TO YOUR WORK A LITTLE WHILE AFTER IT'S TIME TO PUT BY,DEAREST TEACH ME SO TO POUR OUT GRATITUDE AS THOU DOST GOOD,[IMPOSSIBLE - inf/nan loss],False,-999,inf,0.0,0.0,stage1,LibriSpeech/test-clean/2094/142345/2094-142345-0023.flac,2094-142345-0023,0.0,stage1,impossible_target
3,EVERY PLANT IN THE GRASS IS SET FORMALLY GROWS PERFECTLY AND MAY BE REALIZED COMPLETELY,I SHALL BE HAPPY TO TAKE CHARGE OF THEM SAID SIR FERDINANDO,[IMPOSSIBLE - inf/nan loss],False,-999,inf,0.0,0.0,stage1,LibriSpeech/test-clean/1188/133604/1188-133604-0033.flac,1188-133604-0033,0.0,stage1,impossible_target
4,I LOVE THEE WITH THE PASSION PUT TO USE IN MY OLD GRIEFS AND WITH MY CHILDHOOD'S FAITH,THEY WERE CERTAINLY NO NEARER THE SOLUTION OF THEIR PROBLEM,[IMPOSSIBLE - inf/nan loss],False,-999,inf,0.0,0.0,stage1,LibriSpeech/test-clean/908/31957/908-31957-0024.flac,908-31957-0024,0.0,stage1,impossible_target
0,I LOVE THEE FREELY AS MEN STRIVE FOR RIGHT I LOVE THEE PURELY AS THEY TURN FROM PRAISE,HOWEVER THAT WAS OVER NOW THE TREE GONE THE STORY AT AN END,[IMPOSSIBLE - inf/nan loss],False,-999,inf,0.0,0.0,stage1,LibriSpeech/test-clean/908/31957/908-31957-0023.flac,908-31957-0023,0.0,stage1,impossible_target
1,THE COMBINED BANDS OF BOTH THE COUNTRIES PLAYED THE MUSIC AND A FINE SUPPER WAS SERVED,SAID THE FIR TREE THINKING OVER WHAT HE HAD HIMSELF RELATED,[IMPOSSIBLE - inf/nan loss],False,-999,inf,0.0,0.0,stage1,LibriSpeech/test-clean/8555/284449/8555-284449-0020.flac,8555-284449-0020,0.0,stage1,impossible_target
2,THEREFORE HER MAJESTY PAID NO ATTENTION TO ANYONE AND NO ONE PAID ANY ATTENTION TO HER,HUMPY DUMPY FELL DOWNSTAIRS AND YET HE MARRIED THE PRINCESS,[IMPOSSIBLE - inf/nan loss],False,-999,inf,0.0,0.0,stage1,LibriSpeech/test-clean/8555/284447/8555-284447-0007.flac,8555-284447-0007,0.0,stage1,impossible_target
3,EVEN SO I HAD JUST RETURNED FROM AN ARDUOUS JOURNEY EXHAUSTED AND BADLY NEEDING A REST,IF A FELLOW'S BEEN A LITTLE BIT WILD HE'S BEELZEBUB AT ONCE,[IMPOSSIBLE - inf/nan loss],False,-999,inf,0.0,0.0,stage1,LibriSpeech/test-clean/8463/294828/8463-294828-0002.flac,8463-294828-0002,0.0,stage1,impossible_target
4,THE NAUTILUS NEARLY PERISHES IN THE ANTARCTIC AND NEMO SINKS INTO A GROWING DEPRESSION,HERE THEY SAID IS A RASCAL WHO HAS BEEN HARRYING OUR COASTS,[IMPOSSIBLE - inf/nan loss],False,-999,inf,0.0,0.0,stage1,LibriSpeech/test-clean/8463/294825/8463-294825-0012.flac,8463-294825-0012,0.0,stage1,impossible_target
0,IN THIS CASE AS IN MOST OTHERS WHAT MAY BE TAKEN AS CERTAIN IN ADVANCE IS RATHER VAGUE,HERE FRIEND TAKE IT AND HE THRUST IT INTO THE FARMER'S HAND,[IMPOSSIBLE - inf/nan loss],False,-999,inf,0.0,0.0,stage1,LibriSpeech/test-clean/8230/279154/8230-279154-0023.flac,8230-279154-0023,0.0,stage1,impossible_target
1,HE PASSED THROUGH HENLEY SAINT ALBANS AND CAME SO NEAR TO LONDON AS HARROW ON THE HILL,BY THE HAMMER OF THOR SHOUTED GRIM HERE IS NO STINGY COWARD,[IMPOSSIBLE - inf/nan loss],False,-999,inf,0.0,0.0,stage1,LibriSpeech/test-clean/8224/274384/8224-274384-0000.flac,8224-274384-0000,0.0,stage1,impossible_target
2,THE ONLY THING NECESSARY WAS TO FIX SETH REYNOLDS AND THIS HOPKINS ARRANGED PERSONALLY,EXCLAIMED SERVADAC KEEPING HIS EYE UNMOVED AT HIS TELESCOPE,[IMPOSSIBLE - inf/nan loss],False,-999,inf,0.0,0.0,stage1,LibriSpeech/test-clean/6829/68771/6829-68771-0005.flac,6829-68771-0005,0.0,stage1,impossible_target
3,BUT I WRESTLED WITH THIS FELLOW AND DO KNOW THAT HE PLAYED UNFAIRLY IN THE SECOND BOUT,LENGTH OF SERVICE FOURTEEN YEARS THREE MONTHS AND FIVE DAYS,[IMPOSSIBLE - inf/nan loss],False,-999,inf,0.0,0.0,stage1,LibriSpeech/test-clean/61/70968/61-70968-0023.flac,61-70968-0023,0.0,stage1,impossible_target
4,I WAS THINKING IT'S VERY LIKE THE ACE OF HEARTS ANSWERED THE CAPTAIN SOFTLY SMILING ON,BUT WHY DIDN'T YOU TELL ME WHEN YOU WERE HERE IN THE SUMMER,[IMPOSSIBLE - inf/nan loss],False,-999,inf,0.0,0.0,stage1,LibriSpeech/test-clean/5683/32865/5683-32865-0010.flac,5683-32865-0010,0.0,stage1,impossible_target
0,I STOOD WITH MY BACK TO THE WALL FOR I WANTED NO SWORD REACHING OUT OF THE DARK FOR ME,IT'S REALLY TOO WARM IN THIS ROOM TO SING DON'T YOU FEEL IT,[IMPOSSIBLE - inf/nan loss],False,-999,inf,0.0,0.0,stage1,LibriSpeech/test-clean/5142/33396/5142-33396-0024.flac,5142-33396-0024,0.0,stage1,impossible_target
1,NOTHING WAS TO BE DONE BUT TO PUT ABOUT AND RETURN IN DISAPPOINTMENT TOWARDS THE NORTH,HE'S BEEN WANTING TO MARRY HILDA THESE THREE YEARS AND MORE,[IMPOSSIBLE - inf/nan loss],False,-999,inf,0.0,0.0,stage1,LibriSpeech/test-clean/5105/28241/5105-28241-0019.flac,5105-28241-0019,0.0,stage1,impossible_target
2,MY YACHT IS AT YOUR SERVICE SIR EVEN SHOULD YOU REQUIRE TO MAKE A TOUR ROUND THE WORLD,THERE IS A MORE OR LESS ELABORATE SYSTEM OF RANK AND GRADES,[IMPOSSIBLE - inf/nan loss],False,-999,inf,0.0,0.0,stage1,LibriSpeech/test-clean/5105/28240/5105-28240-0019.flac,5105-28240-0019,0.0,stage1,impossible_target
3,IT IS SUCH A NOBLE AMBITION THAT IT IS A PITY IT HAS USUALLY SUCH A SHALLOW FOUNDATION,THE WEATHER IF WE MAY USE THAT TERM WILL CHANGE BEFORE LONG,[IMPOSSIBLE - inf/nan loss],False,-999,inf,0.0,0.0,stage1,LibriSpeech/test-clean/4970/29093/4970-29093-0007.flac,4970-29093-0007,0.0,stage1,impossible_target
4,BARTLEY STARTED WHEN HILDA RANG THE LITTLE BELL BESIDE HER DEAR ME WHY DID YOU DO THAT,I'M SURE ALEXANDRA HOPES YOU WILL STAY ON HERE SHE MURMURED,[IMPOSSIBLE - inf/nan loss],False,-999,inf,0.0,0.0,stage1,LibriSpeech/test-clean/4446/2273/4446-2273-0024.flac,4446-2273-0024,0.0,stage1,impossible_target
0,IN THE EVENINGS I CONFESS I DO THINK BUT I NEVER TROUBLE ANY ONE ELSE WITH MY THOUGHTS,I SUPPOSE IT'S THE WET SEASON WILL YOU HAVE TO CUT THEM TOO,[IMPOSSIBLE - inf/nan loss],False,-999,inf,0.0,0.0,stage1,LibriSpeech/test-clean/3575/170457/3575-170457-0022.flac,3575-170457-0022,0.0,stage1,impossible_target
1,THE VICIOUS CHARACTER OF SIN IS BROUGHT OUT BY THE WORDS WHO GAVE HIMSELF FOR OUR SINS,INDEED HE HAD LOOKED AWAY WITH THE PURPOSE OF NOT SEEING IT,You have to take a few minutes of time and you can easily take a few minutes of time.,False,-1,8.910246849060059,0.15000000596046448,0.10037299245595932,stage1,LibriSpeech/test-clean/2830/3980/2830-3980-0069.flac,2830-3980-0069,0.15,stage1,
2,I THINK THAT WILL DO SHE CONTINUED FOR THE OTHER QUALITIES ARE NOT NEEDED IN A SERVANT,THERE THERE HE SAID SOOTHINGLY PATTING HER BROWN FUZZY HEAD,I'm going to go to the main course. So the area is called the Uho ni Uho's base.,False,-1,8.339178085327148,0.15000000596046448,0.10057979822158813,stage1,LibriSpeech/test-clean/1284/1181/1284-1181-0008.flac,1284-1181-0008,0.15,stage1,
3,HE DARTED LIKE AN ARROW THROUGH ALL THE HALLS DOWN ALL THE STAIRS AND ACROSS THE YARD,THE LAGOON HAD BEEN LEVEL WITH THE DYKES A WEEK AGO AND NOW,[IMPOSSIBLE - inf/nan loss],False,-999,inf,0.0,0.0,stage1,LibriSpeech/test-clean/7021/85628/7021-85628-0020.flac,7021-85628-0020,0.0,stage1,impossible_target
4,BUT YOU MUST NOT EAT WITH YOUR CAP ON YOUR HEAD SHE SAID AND WAS GOING TO TAKE IT OFF,ON THE PALM WERE THREE LITTLE PYRAMIDS OF BLACK DOUGHY CLAY,[IMPOSSIBLE - inf/nan loss],False,-999,inf,0.0,0.0,stage1,LibriSpeech/test-clean/7021/85628/7021-85628-0012.flac,7021-85628-0012,0.0,stage1,impossible_target
0,THE TWIN BROTHER DID SOMETHING SHE DIDN'T LIKE AND SHE TURNED HIS PICTURE TO THE WALL,WATSON I HAVE ALWAYS DONE YOU AN INJUSTICE THERE ARE OTHERS,The,False,-1,8.271069526672363,0.15000000596046448,0.09975050389766693,stage1,LibriSpeech/test-clean/6930/76324/6930-76324-0005.flac,6930-76324-0005,0.15,stage1,
1,THEY REGAINED THEIR APARTMENT APPARENTLY WITHOUT DISTURBING THE HOUSEHOLD OF GAMEWELL,NUMBER TEN FRESH NELLY IS WAITING ON YOU GOOD NIGHT HUSBAND,[IMPOSSIBLE - inf/nan loss],False,-999,inf,0.0,0.0,stage1,LibriSpeech/test-clean/61/70970/61-70970-0040.flac,61-70970-0040,0.0,stage1,impossible_target
2,IN THE NATURE OF THINGS LUXURIES AND THE COMFORTS OF LIFE BELONG TO THE LEISURE CLASS,COME FORTH WORM AND THE SILENT VALLEY TO THY PENSIVE QUEEN,"It's in remote terms in land-clazed and sometimes different lands, or means that it won't be more tight.",False,-1,9.067118644714355,0.15000000596046448,0.09958256781101227,stage1,LibriSpeech/test-clean/3570/5694/3570-5694-0004.flac,3570-5694-0004,0.15,stage1,
3,I WISH I HADN'T CRIED SO MUCH SAID ALICE AS SHE SWAM ABOUT TRYING TO FIND HER WAY OUT,JOHN WESLEY COMBASH JACOB TAYLOR AND THOMAS EDWARD SKINNER,[IMPOSSIBLE - inf/nan loss],False,-999,inf,0.0,0.0,stage1,LibriSpeech/test-clean/260/123440/260-123440-0015.flac,260-123440-0015,0.0,stage1,impossible_target
4,A SUFFOCATING SMELL OF NITROGEN FILLS THE AIR IT ENTERS THE THROAT IT FILLS THE LUNGS,HOW YOU MAY BE WONDERING ARE YOU TO BEGIN YOUR MASTERPIECE,[IMPOSSIBLE - inf/nan loss],False,-999,inf,0.0,0.0,stage1,LibriSpeech/test-clean/260/123288/260-123288-0027.flac,260-123288-0027,0.0,stage1,impossible_target
0,I WISH YOU WEREN'T SO RESTLESS AND DIDN'T GET SO WORKED UP OVER THINGS SHE SAID SADLY,TO BE OR NOT TO BE THAT IS THE QUESTION WHETHER TIS NOBLER,and it's basically tax-closed right after this. So you can do a good job of talking to tall-closed people in terms of their work.,False,-1,8.9552640914917,0.15000000596046448,0.10004039108753204,stage1,LibriSpeech/test-clean/237/134500/237-134500-0033.flac,237-134500-0033,0.15,stage1,
1,HENCE THE EDISON ELECTROLYTIC METER IS NO LONGER USED DESPITE ITS EXCELLENT QUALITIES,MY TONGUE REFUSED TO ARTICULATE MY POWER OF SPEECH LEFT ME,[IMPOSSIBLE - inf/nan loss],False,-999,inf,0.0,0.0,stage1,LibriSpeech/test-clean/2300/131720/2300-131720-0029.flac,2300-131720-0029,0.0,stage1,impossible_target
2,WHY IF WE ERECT A STATION AT THE FALLS IT IS A GREAT ECONOMY TO GET IT UP TO THE CITY,PERCHANCE TOO KAFFAR'S DEATH MIGHT SERVE HIM IN GOOD STEAD,[IMPOSSIBLE - inf/nan loss],False,-999,inf,0.0,0.0,stage1,LibriSpeech/test-clean/2300/131720/2300-131720-0005.flac,2300-131720-0005,0.0,stage1,impossible_target
3,THE MOMENT I LOOKED AT MY TABLE I WAS AWARE THAT SOMEONE HAD RUMMAGED AMONG MY PAPERS,SAID ANOTHER VOICE WHICH I RECOGNIZED AS VOLTAIRE'S KAFFAR,[IMPOSSIBLE - inf/nan loss],False,-999,inf,0.0,0.0,stage1,LibriSpeech/test-clean/1580/141083/1580-141083-0007.flac,1580-141083-0007,0.0,stage1,impossible_target
4,FOR A LONG TIME HE HAD WISHED TO EXPLORE THE BEAUTIFUL LAND OF OZ IN WHICH THEY LIVED,NOW WHAT WAS THE SENSE OF IT TWO INNOCENT BABIES LIKE THAT,[IMPOSSIBLE - inf/nan loss],False,-999,inf,0.0,0.0,stage1,LibriSpeech/test-clean/1284/1180/1284-1180-0003.flac,1284-1180-0003,0.0,stage1,impossible_target
0,SOMEONE ELSE TOLD A STORY NOT PARTICULARLY EFFECTIVE WHICH I SAW HE WAS NOT FOLLOWING,TRULY SUCH A HORSE SHOULD BE WORTH MUCH IN NOTTINGHAM FAIR,[IMPOSSIBLE - inf/nan loss],False,-999,inf,0.0,0.0,stage1,LibriSpeech/test-clean/121/127105/121-127105-0001.flac,121-127105-0001,0.0,stage1,impossible_target
