example_idx,original_text,target_text,final_text,success,success_iteration,final_loss,max_perturbation,mean_perturbation,stage,audio_file,audio_name,stage1_distortion,final_stage,reason
4,LEND ME YOUR EAR FOR TEN MINUTES AND YOU SHALL LEARN JUST WHAT STAGECRAFT IS,ALEXANDER GROANED I MEANT TO BUT SOMEHOW I COULDN'T,"to the New Year's Eve, both on the note. Thank you for having us.",False,-1,9.664664268493652,0.15000000596046448,0.0995950847864151,stage1,LibriSpeech/test-clean/7176/92135/7176-92135-0008.flac,7176-92135-0008,0.15,stage1,
0,IT MIGHT HAVE SEEMED THAT A TROUT OF THIS SIZE WAS A FAIRLY SUBSTANTIAL MEAL,AFTER THAT IT WAS EASY TO FORGET ACTUALLY TO FORGET,So yet it's clean product that is why it's produced through the system.,False,-1,8.668872833251953,0.15000000596046448,0.09981518983840942,stage1,LibriSpeech/test-clean/7176/88083/7176-88083-0006.flac,7176-88083-0006,0.15,stage1,
1,GENTLEMEN TO YOUR POSTS WHEREUPON SAINT AIGNAN AND VILLEROY TOOK THEIR LEAVE,MAINHALL LIKED ALEXANDER BECAUSE HE WAS AN ENGINEER,[IMPOSSIBLE - inf/nan loss],False,-999,inf,0.0,0.0,stage1,LibriSpeech/test-clean/7127/75946/7127-75946-0003.flac,7127-75946-0003,0.0,stage1,impossible_target
2,IT DID NOT BECKON OR INDEED MOVE AT ALL IT WAS AS STILL AS THE HAND OF DEATH,HERE GO AND GET ME CHANGE FOR A LOUIS I HAVE IT SIR,"as they can get out of your bed and compare it with a needle to a five. You can get a needle in there, so you can get in there.",False,-1,9.616500854492188,0.15000000596046448,0.10004233568906784,stage1,LibriSpeech/test-clean/6930/81414/6930-81414-0008.flac,6930-81414-0008,0.15,stage1,
3,I WAS BOOKKEEPER SO IT WAS EASY TO GET A BLANK CHECK AND FORGE THE SIGNATURE,COME COME I AM GETTING REALLY TIRED OF YOUR ABSENCE,"I just get to the point, the answers are clear. I got six points to go right here.",False,-1,9.928847312927246,0.15000000596046448,0.0994781032204628,stage1,LibriSpeech/test-clean/6829/68769/6829-68769-0030.flac,6829-68769-0030,0.15,stage1,
4,I'M RUNNING FOR REPRESENTATIVE ON THE REPUBLICAN TICKET SAID KENNETH QUIETLY,BUT YOU BELIEVE IN SOME EDUCATION ASKED MARY TAYLOR,[IMPOSSIBLE - inf/nan loss],False,-999,inf,0.0,0.0,stage1,LibriSpeech/test-clean/6829/68769/6829-68769-0011.flac,6829-68769-0011,0.0,stage1,impossible_target
0,BUT IN SUCH A CASE MISS MILNER'S ELECTION OF A HUSBAND SHALL NOT DIRECT MINE,SO CHOOSE FOR YOURSELF TO MAKE A RUSH OR TARRY HERE,[IMPOSSIBLE - inf/nan loss],False,-999,inf,0.0,0.0,stage1,LibriSpeech/test-clean/4992/23283/4992-23283-0010.flac,4992-23283-0010,0.0,stage1,impossible_target
1,TO TEACH READING MEANS TO LIGHT THE FIRE EVERY SYLLABLE SPELLED OUT SPARKLES,BUT WAS THAT ALL HER REWARD ONE OF THE LADIES ASKED,as it's close to 8.899.1.1.1.1.1.1.1.1.1.1.1.1.1.1.1.1.1.1.1.1.1.1.1.1.1.1.1.1.1.1.1.1.1.1.1.1.1.1.1.1.1.1.1.1.1.1.1.1.1.1.1.1.1.1.1.1.1.1.1.1.1.1.1.1.1.1.1.1.1.1.1.1.1.1.1.1.1.1.1.1.1.1.1.1.1.1.1.1.1.1.1.1.1.1.1.1.1.1.1.1.1.1.1.1.1.1.1.1.1.1.1.1.1.1.1.1.1.1.1.1.1.1.1.1.1.1.1.1.1.1.1.1.1.1.1.1.1.1.1.1.1.1.1.1.1.1.1.1.1.1.1.1.1.1.1.1.1.1.1.1.1.1.1.1.1.1.1.1.1.1.1.1.1.1.1.1.1.1.1.1.1.1.1.1.1.1.1.1.1.1.1.1.1.1.1.1.1.1.1.1.1.1.1.1.1.1.1.1.1.1.1.1.1.1.1.1.1.,False,-1,9.471223831176758,0.15000000596046448,0.09942823648452759,stage1,LibriSpeech/test-clean/4507/16021/4507-16021-0055.flac,4507-16021-0055,0.15,stage1,
2,GRACE BE TO YOU AND PEACE FROM GOD THE FATHER AND FROM OUR LORD JESUS CHRIST,HE QUITTED THE FIRE AND DROPPED BACK INTO HIS CHAIR,The light of grace will continue to heal and heal our soul. And do one way through the sunlight.,False,-1,9.03519344329834,0.15000000596046448,0.09968414157629013,stage1,LibriSpeech/test-clean/2830/3980/2830-3980-0038.flac,2830-3980-0038,0.15,stage1,
3,IT'LL BE NO USE THEIR PUTTING THEIR HEADS DOWN AND SAYING COME UP AGAIN DEAR,WHY AN EAR A WHIRLPOOL FIERCE TO DRAW CREATIONS IN,[IMPOSSIBLE - inf/nan loss],False,-999,inf,0.0,0.0,stage1,LibriSpeech/test-clean/260/123440/260-123440-0012.flac,260-123440-0012,0.0,stage1,impossible_target
4,NO NO NO TOTTY UD GET HER FEET WET SAID MISSUS POYSER CARRYING AWAY HER IRON,AS USUAL NOTHING WAS DONE IN THE WAY OF PUNISHMENT,"This was me knowing you know I'm doing. Audrey, get a sweet nap. Don't worry about Grandma.",False,-1,10.178447723388672,0.15000000596046448,0.10004846006631851,stage1,LibriSpeech/test-clean/2094/142345/2094-142345-0028.flac,2094-142345-0028,0.15,stage1,
0,WELL WHAT CAN'T BE DONE BY MAIN COURAGE IN WAR MUST BE DONE BY CIRCUMVENTION,WHAT WOULD BECOME OF YOUR GUN WERE I TO KIDNAP YOU,"So, for sure, I want to take what connects and the balance of the new year's quarter of the day, because we want to come away with a question again.",False,-1,9.6859130859375,0.15000000596046448,0.10009091347455978,stage1,LibriSpeech/test-clean/1320/122617/1320-122617-0026.flac,1320-122617-0026,0.15,stage1,
1,BUT THE BEAR INSTEAD OF OBEYING MAINTAINED THE SEAT IT HAD TAKEN AND GROWLED,NO DOUBT IN PROCESS OF TIME THE LADIES WILL FOLLOW,[IMPOSSIBLE - inf/nan loss],False,-999,inf,0.0,0.0,stage1,LibriSpeech/test-clean/1320/122617/1320-122617-0015.flac,1320-122617-0015,0.0,stage1,impossible_target
2,MOST PEOPLE TALK TOO MUCH SO IT IS A RELIEF TO FIND ONE WHO TALKS TOO LITTLE,THIS WAS AT THE MARCH ELECTION EIGHTEEN FIFTY FIVE,[IMPOSSIBLE - inf/nan loss],False,-999,inf,0.0,0.0,stage1,LibriSpeech/test-clean/1284/1181/1284-1181-0015.flac,1284-1181-0015,0.0,stage1,impossible_target
3,AT THE EMERALD CITY WHERE OUR PRINCESS OZMA LIVES GREEN IS THE POPULAR COLOR,NATURE OF THE EFFECT PRODUCED BY EARLY IMPRESSIONS,"It's definitely one of those things where when time flies together, you're easy to take a good look at them. Thank you.",False,-1,7.410611629486084,0.15000000596046448,0.10005959868431091,stage1,LibriSpeech/test-clean/1284/1180/1284-1180-0031.flac,1284-1180-0031,0.15,stage1,
4,THAT A STYLE IS RESTRAINED OR SEVERE DOES NOT MEAN THAT IT IS ALSO ERRONEOUS,ISN'T HE THE GREATEST FOR GETTING INTO ODD CORNERS,5,False,-1,9.583358764648438,0.15000000596046448,0.0998699963092804,stage1,LibriSpeech/test-clean/1188/133604/1188-133604-0017.flac,1188-133604-0017,0.15,stage1,
0,FOR A FULL HOUR HE HAD PACED UP AND DOWN WAITING BUT HE COULD WAIT NO LONGER,IT WON'T BE MUCH BUT I'M GRATEFUL TO FIND A FRIEND,[IMPOSSIBLE - inf/nan loss],False,-999,inf,0.0,0.0,stage1,LibriSpeech/test-clean/1089/134691/1089-134691-0001.flac,1089-134691-0001,0.0,stage1,impossible_target
1,WE SAT WITH THE OFFICERS SOME LITTLE TIME AFTER DINNER AND THEN WENT ASHORE,WHOSE NAME DID YOU SIGN TO THE CHECK ASKED KENNETH,It's very hot.,False,-1,10.598562240600586,0.15000000596046448,0.10010043531656265,stage1,LibriSpeech/test-clean/8455/210777/8455-210777-0023.flac,8455-210777-0023,0.15,stage1,
2,ONCE FAIRLY A WING HOWEVER HE WHEELED AND MADE BACK HURRIEDLY FOR HIS PERCH,WORSE TOM WORSE N EVER REPLIED THE JAILER GLOOMILY,"Once joining the game manager, do a new order and you may know the top of the topic of the day.",False,-1,11.367661476135254,0.15000000596046448,0.10015824437141418,stage1,LibriSpeech/test-clean/7176/88083/7176-88083-0005.flac,7176-88083-0005,0.15,stage1,
3,IT IS TOO DIFFICULT REPLIED MADEMOISELLE DE TONNAY CHARENTE LAUGHING LOUDLY,PRAY FOLLOW US WITH MINE AND MY LORD SHERIFF'S MEN,[IMPOSSIBLE - inf/nan loss],False,-999,inf,0.0,0.0,stage1,LibriSpeech/test-clean/7127/75947/7127-75947-0023.flac,7127-75947-0023,0.0,stage1,impossible_target
4,THEN SHE GAVE A LITTLE LAUGH AND REPLIED NO MISS BETH I'M ELIZABETH PARSONS,MONTFICHET CALLED OUT FOR ROBIN TO GIVE HIM AN ARM,[IMPOSSIBLE - inf/nan loss],False,-999,inf,0.0,0.0,stage1,LibriSpeech/test-clean/6829/68771/6829-68771-0020.flac,6829-68771-0020,0.0,stage1,impossible_target
0,WE HAVE HEARD SOMETHING OF YOUR STORY SAID KENNETH AND ARE INTERESTED IN IT,WELL SHE WAS BETTER THOUGH SHE HAD HAD A BAD NIGHT,[IMPOSSIBLE - inf/nan loss],False,-999,inf,0.0,0.0,stage1,LibriSpeech/test-clean/6829/68769/6829-68769-0022.flac,6829-68769-0022,0.0,stage1,impossible_target
1,WHY ONE MORNING THERE CAME A QUANTITY OF PEOPLE AND SET TO WORK IN THE LOFT,WE SUNK HIS SHIP AND MEN BUT HIM WE BROUGHT TO YOU,[IMPOSSIBLE - inf/nan loss],False,-999,inf,0.0,0.0,stage1,LibriSpeech/test-clean/672/122797/672-122797-0066.flac,672-122797-0066,0.0,stage1,impossible_target
2,IN AUTUMN THE WOOD CUTTERS ALWAYS CAME AND FELLED SOME OF THE LARGEST TREES,THEY COULDN'T RUN NOR MOVE THEY'RE JUST PASTEBOARD,the,False,-1,10.164283752441406,0.15000000596046448,0.0992991030216217,stage1,LibriSpeech/test-clean/672/122797/672-122797-0007.flac,672-122797-0007,0.15,stage1,
3,AND HE MADE A LITTLE DIP OF HIS CANE TOWARDS BRANDON HALL OVER HIS SHOULDER,THY WAYS GREATLY TRY ME RUTH AND ALL THY RELATIONS,[IMPOSSIBLE - inf/nan loss],False,-999,inf,0.0,0.0,stage1,LibriSpeech/test-clean/5683/32866/5683-32866-0005.flac,5683-32866-0005,0.0,stage1,impossible_target
4,ALL THE TIME HE WAS TALKING TO ME HIS ANGRY LITTLE EYES WERE FOLLOWING LAKE,BUT HOW DID SHE MANAGE TO RENDER IT SO FASHIONABLE,[IMPOSSIBLE - inf/nan loss],False,-999,inf,0.0,0.0,stage1,LibriSpeech/test-clean/5683/32865/5683-32865-0017.flac,5683-32865-0017,0.0,stage1,impossible_target
0,DO YOU KNOW LAKE OH I REALLY CAN'T TELL BUT HE'LL SOON TIRE OF COUNTRY LIFE,HE NEVER LOSES SIGHT OF THE PURPOSE OF HIS EPISTLE,[IMPOSSIBLE - inf/nan loss],False,-999,inf,0.0,0.0,stage1,LibriSpeech/test-clean/5683/32865/5683-32865-0013.flac,5683-32865-0013,0.0,stage1,impossible_target
1,MEANWHILE RODOLFO HAD LEOCADIA SAFE IN HIS CUSTODY AND IN HIS OWN APARTMENT,LET US BEGIN WITH THAT HIS COMMENTARY ON GALATIANS,[IMPOSSIBLE - inf/nan loss],False,-999,inf,0.0,0.0,stage1,LibriSpeech/test-clean/5639/40744/5639-40744-0007.flac,5639-40744-0007,0.0,stage1,impossible_target
2,A MORE DREARY AND MORE DISUNITED FAMILY PARTY I NEVER SAT AT THE TABLE WITH,IF SHE COULD ONLY SEE PHRONSIE FOR JUST ONE MOMENT,[IMPOSSIBLE - inf/nan loss],False,-999,inf,0.0,0.0,stage1,LibriSpeech/test-clean/5142/36377/5142-36377-0020.flac,5142-36377-0020,0.0,stage1,impossible_target
3,NO CATHEDRAL NOT EVEN BURGOS ITSELF COULD VIE WITH THE CHURCH AT MONTMARTRE,I NOW USE THEM AS ORNAMENTAL STATUARY IN MY GARDEN,[IMPOSSIBLE - inf/nan loss],False,-999,inf,0.0,0.0,stage1,LibriSpeech/test-clean/5105/28233/5105-28233-0006.flac,5105-28233-0006,0.0,stage1,impossible_target
4,RUTH SAT QUITE STILL FOR A TIME WITH FACE INTENT AND FLUSHED IT WAS OUT NOW,IT WAS ALMOST THE TONE OF HOPE EVERYBODY WILL STAY,[IMPOSSIBLE - inf/nan loss],False,-999,inf,0.0,0.0,stage1,LibriSpeech/test-clean/4970/29095/4970-29095-0016.flac,4970-29095-0016,0.0,stage1,impossible_target
0,IS THY FATHER WILLING THEE SHOULD GO AWAY TO A SCHOOL OF THE WORLD'S PEOPLE,HARANGUE THE TIRESOME PRODUCT OF A TIRELESS TONGUE,[IMPOSSIBLE - inf/nan loss],False,-999,inf,0.0,0.0,stage1,LibriSpeech/test-clean/4970/29095/4970-29095-0006.flac,4970-29095-0006,0.0,stage1,impossible_target
1,THE WORLD IS ALL THERE JUST AS IT USED TO BE BUT I CAN'T GET AT IT ANY MORE,SOON THE WHOLE BRIDGE WAS TREMBLING AND RESOUNDING,So draw this out where you can get the other use of these or contact us for granted.,False,-1,9.161985397338867,0.15000000596046448,0.10001521557569504,stage1,LibriSpeech/test-clean/4446/2275/4446-2275-0019.flac,4446-2275-0019,0.15,stage1,
2,DO YOU KNOW I THOUGHT THE DANCE A BIT CONSCIOUS TO NIGHT FOR THE FIRST TIME,HE IS CALLED AS YOU KNOW THE APOSTLE OF THE INDIES,[IMPOSSIBLE - inf/nan loss],False,-999,inf,0.0,0.0,stage1,LibriSpeech/test-clean/4446/2271/4446-2271-0013.flac,4446-2271-0013,0.0,stage1,impossible_target
3,I SIT DOWN AT A SMALL TABLE A WAITER COMES IMMEDIATELY TO ENQUIRE MY WISHES,WHY A TONGUE IMPRESS'D WITH HONEY FROM EVERY WIND,[IMPOSSIBLE - inf/nan loss],False,-999,inf,0.0,0.0,stage1,LibriSpeech/test-clean/3729/6852/3729-6852-0018.flac,3729-6852-0018,0.0,stage1,impossible_target
4,THERE IS EVEN A WHITE ROW OF BEEHIVES IN THE ORCHARD UNDER THE WALNUT TREES,BUT I DO NOT THINK SUCH AN INFERENCE IS WARRANTED,[IMPOSSIBLE - inf/nan loss],False,-999,inf,0.0,0.0,stage1,LibriSpeech/test-clean/237/134493/237-134493-0018.flac,237-134493-0018,0.0,stage1,impossible_target
0,BUT CRESSWELL ADDED SIGNIFICANTLY CAPACITY DIFFERS ENORMOUSLY BETWEEN RACES,THE BOGUS LEGISLATURE NUMBERED THIRTY SIX MEMBERS,[IMPOSSIBLE - inf/nan loss],False,-999,inf,0.0,0.0,stage1,LibriSpeech/test-clean/1995/1836/1995-1836-0009.flac,1995-1836-0009,0.0,stage1,impossible_target
1,WELL WELL DON'T TROUBLE TO ANSWER LISTEN AND SEE THAT I DO YOU NO INJUSTICE,THEN IS THE TIME TO INTRODUCE A MEAL ON THE STAGE,[IMPOSSIBLE - inf/nan loss],False,-999,inf,0.0,0.0,stage1,LibriSpeech/test-clean/1580/141084/1580-141084-0034.flac,1580-141084-0034,0.0,stage1,impossible_target
2,AS A MATTER OF FACT HE COULD NOT SAID SOAMES FOR I ENTERED BY THE SIDE DOOR,RELAPSES INTO SILENCE FOR THE REST OF THE EVENING,"The system changes in the relevant terms, even the small.",False,-1,8.915955543518066,0.15000000596046448,0.09987041354179382,stage1,LibriSpeech/test-clean/1580/141083/1580-141083-0026.flac,1580-141083-0026,0.15,stage1,
3,THE HAIR WAS OF BROWN YARN AND HUNG DOWN ON HER NECK IN SEVERAL NEAT BRAIDS,BUT THIS WAS WHAT THE TREE COULD NOT BEAR TO HEAR,It's a great experience.,False,-1,9.480263710021973,0.15000000596046448,0.09999029338359833,stage1,LibriSpeech/test-clean/1284/1181/1284-1181-0003.flac,1284-1181-0003,0.15,stage1,
4,PLEASE FORGIVE ME FOR THIS UNDERHANDED WAY OF ADMITTING I HAD TURNED FORTY,ENQUIRED ROBIN WITH HIS SUSPICIONS STILL UPON HIM,"The vehicle can be equipped with its highest-estepened range, rigidity, and high-speed vehicle.",False,-1,8.942521095275879,0.15000000596046448,0.09973624348640442,stage1,LibriSpeech/test-clean/8463/294828/8463-294828-0012.flac,8463-294828-0012,0.15,stage1,
0,MONSIEUR WAS THE ONLY ONE WHO DID NOT UNDERSTAND ANYTHING ABOUT THE MATTER,TAKE HIM OUT THORKEL AND LET HIM TASTE YOUR SWORD,[IMPOSSIBLE - inf/nan loss],False,-999,inf,0.0,0.0,stage1,LibriSpeech/test-clean/7127/75946/7127-75946-0024.flac,7127-75946-0024,0.0,stage1,impossible_target
1,AND MY POCKET MONEY IS GETTING LOW AGAIN AND YOU HAVEN'T ANY LEFT AS USUAL,MAY YOU DRINK HEART'S EASE FROM IT FOR MANY YEARS,[IMPOSSIBLE - inf/nan loss],False,-999,inf,0.0,0.0,stage1,LibriSpeech/test-clean/6930/76324/6930-76324-0023.flac,6930-76324-0023,0.0,stage1,impossible_target
2,THEY THEY EXCITE ME IN SOME WAY AND I I CAN'T BEAR THEM YOU MUST EXCUSE ME,I HAVE NOTHING TO WEAR REPLIED THAT DEMURE PERSON,[IMPOSSIBLE - inf/nan loss],False,-999,inf,0.0,0.0,stage1,LibriSpeech/test-clean/6829/68771/6829-68771-0027.flac,6829-68771-0027,0.0,stage1,impossible_target
3,YOU SPEAK LIKE AN EDUCATED PERSON SAID BETH WONDERINGLY WHERE IS YOUR HOME,HE WAS UNABLE TO DECIDE EXACTLY WHAT IT SHOULD BE,[IMPOSSIBLE - inf/nan loss],False,-999,inf,0.0,0.0,stage1,LibriSpeech/test-clean/6829/68771/6829-68771-0023.flac,6829-68771-0023,0.0,stage1,impossible_target
4,THE HOURS PASSED WEARILY BY AND MOVEMENT COULD YET BE HEARD ABOUT THE HALL,ALEXANDER WENT OVER AND OPENED THE WINDOW FOR HER,The average is the inner range of the finite unit.,False,-1,11.185090065002441,0.15000000596046448,0.09995924681425095,stage1,LibriSpeech/test-clean/61/70970/61-70970-0018.flac,61-70970-0018,0.15,stage1,
0,AT THE PROW I CARVED THE HEAD WITH OPEN MOUTH AND FORKED TONGUE THRUST OUT,SHE HAD ANOTHER WEIGHT ON HER MIND THIS CHRISTMAS,[IMPOSSIBLE - inf/nan loss],False,-999,inf,0.0,0.0,stage1,LibriSpeech/test-clean/5142/33396/5142-33396-0007.flac,5142-33396-0007,0.0,stage1,impossible_target
1,HE SEEMED BORN TO PLEASE WITHOUT BEING CONSCIOUS OF THE POWER HE POSSESSED,THE ORCHARD WAS SPARKLING AND RIPPLING IN THE SUN,[IMPOSSIBLE - inf/nan loss],False,-999,inf,0.0,0.0,stage1,LibriSpeech/test-clean/5105/28233/5105-28233-0001.flac,5105-28233-0001,0.0,stage1,impossible_target
2,HE MENTIONS THE APOSTLES FIRST BECAUSE THEY WERE APPOINTED DIRECTLY BY GOD,WHEN I APPROACHED YOUR ROOM I EXAMINED THE WINDOW,[IMPOSSIBLE - inf/nan loss],False,-999,inf,0.0,0.0,stage1,LibriSpeech/test-clean/2830/3980/2830-3980-0013.flac,2830-3980-0013,0.0,stage1,impossible_target
3,A BRISK WIND HAD COME UP AND WAS DRIVING PUFFY WHITE CLOUDS ACROSS THE SKY,OJO EXAMINED THIS CURIOUS CONTRIVANCE WITH WONDER,[IMPOSSIBLE - inf/nan loss],False,-999,inf,0.0,0.0,stage1,LibriSpeech/test-clean/237/134500/237-134500-0002.flac,237-134500-0002,0.0,stage1,impossible_target
4,HE DARTED THROUGH THE TREES AND PAUSED A TALL MAN STRONGLY BUT SLIMLY MADE,I'M AFRAID I DON'T KNOW MUCH ABOUT THE LAND OF OZ,It's a joy to see your students and try to see how amazing the winds are today.,False,-1,9.349467277526855,0.15000000596046448,0.09989695996046066,stage1,LibriSpeech/test-clean/1995/1837/1995-1837-0029.flac,1995-1837-0029,0.15,stage1,
0,JOHN TAYLOR WHO HAD SUPPORTED HER THROUGH COLLEGE WAS INTERESTED IN COTTON,SHE SENT ME THE PAGES IN QUESTION BEFORE SHE DIED,[IMPOSSIBLE - inf/nan loss],False,-999,inf,0.0,0.0,stage1,LibriSpeech/test-clean/1995/1826/1995-1826-0002.flac,1995-1826-0002,0.0,stage1,impossible_target
1,WHEN THEY WERE OUTSIDE UNC SIMPLY LATCHED THE DOOR AND STARTED UP THE PATH,I CAN'T SEE IT IN THAT LIGHT SAID THE OLD LAWYER,[IMPOSSIBLE - inf/nan loss],False,-999,inf,0.0,0.0,stage1,LibriSpeech/test-clean/1284/1180/1284-1180-0004.flac,1284-1180-0004,0.0,stage1,impossible_target
2,YET THESE THOUGHTS AFFECTED HESTER PRYNNE LESS WITH HOPE THAN APPREHENSION,A MONTFICHET A MONTFICHET GAMEWELL TO THE RESCUE,to the campus.,False,-1,11.141654014587402,0.15000000596046448,0.09939249604940414,stage1,LibriSpeech/test-clean/1221/135766/1221-135766-0002.flac,1221-135766-0002,0.15,stage1,
3,THE KING STOOD UP AND CALLED FOR THAT PSALM WHICH BEGINS WITH THESE WORDS,THANK YOU RACHEL MY COUSIN RACHEL MY ONLY FRIEND,[IMPOSSIBLE - inf/nan loss],False,-999,inf,0.0,0.0,stage1,LibriSpeech/test-clean/8224/274384/8224-274384-0006.flac,8224-274384-0006,0.0,stage1,impossible_target
4,GOOD GRACIOUS HAS THE KING ANY RIGHT TO INTERFERE IN MATTERS OF THAT KIND,EFFECTS OF THE INCREASED USE AND DISUSE OF PARTS,[IMPOSSIBLE - inf/nan loss],False,-999,inf,0.0,0.0,stage1,LibriSpeech/test-clean/7127/75947/7127-75947-0035.flac,7127-75947-0035,0.0,stage1,impossible_target
0,OH LET HIM COME ALONG SHE URGED I DO LOVE TO SEE HIM ABOUT THAT OLD HOUSE,THAT TIME IT POINTED US INTO YOUR FATHER'S SHIPS,[IMPOSSIBLE - inf/nan loss],False,-999,inf,0.0,0.0,stage1,LibriSpeech/test-clean/6930/76324/6930-76324-0017.flac,6930-76324-0017,0.0,stage1,impossible_target
1,HE MIGHT HAVE HAD THAT FORGED CHECK FOR THE FACE OF IT IF HE'D BEEN SHARP,THE THRALLS WERE BRINGING IN A GREAT POT OF MEAT,[IMPOSSIBLE - inf/nan loss],False,-999,inf,0.0,0.0,stage1,LibriSpeech/test-clean/6829/68769/6829-68769-0052.flac,6829-68769-0052,0.0,stage1,impossible_target
2,THESE ESCAPADES ARE NOT FOR OLD GAMEWELL LAD HIS DAY HAS COME TO TWILIGHT,NEXT CAME OLIVE'S TURN TO HELP IN THE CEREMONIES,I'm,False,-1,8.728179931640625,0.15000000596046448,0.10025173425674438,stage1,LibriSpeech/test-clean/61/70968/61-70968-0057.flac,61-70968-0057,0.15,stage1,
3,THERE IS HARDLY ONE DAY OUT OF A HUNDRED WHICH IS WHOLLY JOYOUS AND SUNNY,AND YOU BELONG TO THAT SMALL CLASS WHO ARE HAPPY,[IMPOSSIBLE - inf/nan loss],False,-999,inf,0.0,0.0,stage1,LibriSpeech/test-clean/4507/16021/4507-16021-0049.flac,4507-16021-0049,0.0,stage1,impossible_target
4,WHEN DID YOU COME BARTLEY AND HOW DID IT HAPPEN YOU HAVEN'T SPOKEN A WORD,THE EARTH IS NOT DEVOID OF RESEMBLANCE TO A JAIL,You're housemates have a piece of free health you can earn.,False,-1,9.18308162689209,0.15000000596046448,0.09973063319921494,stage1,LibriSpeech/test-clean/4446/2275/4446-2275-0008.flac,4446-2275-0008,0.15,stage1,
0,I THOUGHT IT MIGHT BE SISTER KATE OR COUSIN MIKE WOULD BE HAPPENING ALONG,WE HAVE NEVER UNDERSTOOD THIS SORT OF OBJECTIONS,[IMPOSSIBLE - inf/nan loss],False,-999,inf,0.0,0.0,stage1,LibriSpeech/test-clean/4446/2275/4446-2275-0006.flac,4446-2275-0006,0.0,stage1,impossible_target
1,I SHALL BE PUNISHED FOR IT NOW I SUPPOSE BY BEING DROWNED IN MY OWN TEARS,MADAME QUINSON BESIDES CAN ANSWER YOUR ENQUIRIES,[IMPOSSIBLE - inf/nan loss],False,-999,inf,0.0,0.0,stage1,LibriSpeech/test-clean/260/123440/260-123440-0016.flac,260-123440-0016,0.0,stage1,impossible_target
2,THE SHADOW OF THE RAFT WAS CLEARLY OUTLINED UPON THE SURFACE OF THE WAVES,MEN SHOULD NOT SPECULATE ABOUT THE NATURE OF GOD,[IMPOSSIBLE - inf/nan loss],False,-999,inf,0.0,0.0,stage1,LibriSpeech/test-clean/260/123286/260-123286-0013.flac,260-123286-0013,0.0,stage1,impossible_target
3,BUT THE PLANT RAN AND IT WAS THE FIRST THREE WIRE STATION IN THIS COUNTRY,I'LL TRY IF I KNOW ALL THE THINGS I USED TO KNOW,[IMPOSSIBLE - inf/nan loss],False,-999,inf,0.0,0.0,stage1,LibriSpeech/test-clean/2300/131720/2300-131720-0024.flac,2300-131720-0024,0.0,stage1,impossible_target
4,THE SQUARES OF COTTON SHARP EDGED HEAVY WERE JUST ABOUT TO BURST TO BOLLS,MISTER EDISON WAS A LEADER FAR AHEAD OF THE TIME,[IMPOSSIBLE - inf/nan loss],False,-999,inf,0.0,0.0,stage1,LibriSpeech/test-clean/1995/1837/1995-1837-0015.flac,1995-1837-0015,0.0,stage1,impossible_target
0,THE MAN ENTERED AND TOOK THE PAPERS SHEET BY SHEET FROM THE CENTRAL TABLE,HE STARTED AT THE THOUGHT HE HURRIED FORTH SADLY,[IMPOSSIBLE - inf/nan loss],False,-999,inf,0.0,0.0,stage1,LibriSpeech/test-clean/1580/141083/1580-141083-0025.flac,1580-141083-0025,0.0,stage1,impossible_target
1,HOTEL A PLACE WHERE A GUEST OFTEN GIVES UP GOOD DOLLARS FOR POOR QUARTERS,BUT JOHN THERE'S NO SOCIETY JUST ELEMENTARY WORK,[IMPOSSIBLE - inf/nan loss],False,-999,inf,0.0,0.0,stage1,LibriSpeech/test-clean/121/121726/121-121726-0009.flac,121-121726-0009,0.0,stage1,impossible_target
2,I EXPECT YOU HAVE BEEN A VERY GOOD GIRL ANDELLA SINCE YOU WERE HERE LAST,THE EXAMINATION HOWEVER RESULTED IN NO DISCOVERY,[IMPOSSIBLE - inf/nan loss],False,-999,inf,0.0,0.0,stage1,LibriSpeech/test-clean/7021/79740/7021-79740-0006.flac,7021-79740-0006,0.0,stage1,impossible_target
3,TO GIVE AN IDEA OF THESE CONVERSATIONS I WILL REPORT ONE OF THEM IN FULL,YET THAT TASK WAS NOT SO EASY AS YOU MAY SUPPOSE,[IMPOSSIBLE - inf/nan loss],False,-999,inf,0.0,0.0,stage1,LibriSpeech/test-clean/7021/79740/7021-79740-0003.flac,7021-79740-0003,0.0,stage1,impossible_target
4,WE OUGHT TO HAVE MORE ATTENDANTS BETH SAID LOUISE APPROACHING HER COUSIN,IT IS HARDLY NECESSARY TO SAY MORE OF THEM HERE,[IMPOSSIBLE - inf/nan loss],False,-999,inf,0.0,0.0,stage1,LibriSpeech/test-clean/6829/68771/6829-68771-0014.flac,6829-68771-0014,0.0,stage1,impossible_target
0,IT WAS BETTER FOR HIM TO THINK THE GIRL UNFEELING THAN TO KNOW THE TRUTH,LIEUTENANT CROSSTREES IS A VERY GALLANT OFFICER,Please support us.,False,-1,10.773635864257812,0.15000000596046448,0.10003264993429184,stage1,LibriSpeech/test-clean/6829/68769/6829-68769-0033.flac,6829-68769-0033,0.15,stage1,
1,BUT UNDER THE CIRCUMSTANCES I DOUBT IF SUCH AN ARRANGEMENT COULD BE MADE,AND WHAT SORT OF EVIDENCE IS LOGICALLY POSSIBLE,[IMPOSSIBLE - inf/nan loss],False,-999,inf,0.0,0.0,stage1,LibriSpeech/test-clean/6829/68769/6829-68769-0007.flac,6829-68769-0007,0.0,stage1,impossible_target
2,SOFT HEART HE SAID GENTLY TO HER THEN TO THORKEL WELL LET HIM GO THORKEL,REMAIN I IMPLORE YOU THE EVENING IS MOST LOVELY,[IMPOSSIBLE - inf/nan loss],False,-999,inf,0.0,0.0,stage1,LibriSpeech/test-clean/5142/33396/5142-33396-0065.flac,5142-33396-0065,0.0,stage1,impossible_target
3,WELL MOTHER SAID THE YOUNG STUDENT LOOKING UP WITH A SHADE OF IMPATIENCE,IT HAS COST ME TWICE SIXTY DOLLARS IN ANNOYANCE,[IMPOSSIBLE - inf/nan loss],False,-999,inf,0.0,0.0,stage1,LibriSpeech/test-clean/4970/29095/4970-29095-0002.flac,4970-29095-0002,0.0,stage1,impossible_target
4,THE ARMY FOUND THE PEOPLE IN POVERTY AND LEFT THEM IN COMPARATIVE WEALTH,SORRY WE HAVEN'T ANY RECEPTION ROOM IN THE JAIL,[IMPOSSIBLE - inf/nan loss],False,-999,inf,0.0,0.0,stage1,LibriSpeech/test-clean/4077/13754/4077-13754-0000.flac,4077-13754-0000,0.0,stage1,impossible_target
0,AND WHAT WAS THE SUBJECT OF THE POEM SAID THE PERSON WHO MADE THE REMARK,THERE'S MANY A ONE CONSIDERABLY OLDER THAN I AM,[IMPOSSIBLE - inf/nan loss],False,-999,inf,0.0,0.0,stage1,LibriSpeech/test-clean/2961/961/2961-961-0006.flac,2961-961-0006,0.0,stage1,impossible_target
1,UNDERSCORE THESE WORDS FOR THEY ARE FULL OF COMFORT FOR SORE CONSCIENCES,DISMISS YOUR SQUIRE ROBIN AND BID ME GOOD E E N,[IMPOSSIBLE - inf/nan loss],False,-999,inf,0.0,0.0,stage1,LibriSpeech/test-clean/2830/3980/2830-3980-0063.flac,2830-3980-0063,0.0,stage1,impossible_target
2,IT'S EXCITING TO SEE EVERYTHING GROWING SO FAST AND TO GET THE GRASS CUT,AND HENRY MIGHT RETURN TO ENGLAND AT ANY MOMENT,The describe can be too ideal for all you control yourself and you've got the flow in it to be too simple.,False,-1,9.747928619384766,0.15000000596046448,0.10023171454668045,stage1,LibriSpeech/test-clean/237/134500/237-134500-0010.flac,237-134500-0010,0.15,stage1,
3,BY THE BY I'VE NEVER SEEN YOUR DAIRY I MUST SEE YOUR DAIRY MISSUS POYSER,LIKE AS NOT YOUNG MASTER THOUGH I AM AN OLD MAN,[IMPOSSIBLE - inf/nan loss],False,-999,inf,0.0,0.0,stage1,LibriSpeech/test-clean/2094/142345/2094-142345-0058.flac,2094-142345-0058,0.0,stage1,impossible_target
